ID,Title,Text,Subreddit,URL,Upvote Ratio,Media Only,Media Type,Media URL,Media Title,Permalink,Subreddit Subscribers,Report ReasonsRemoval Reasons,Author,Is Original Content,Is Crosspostable,Num Crossposts,Ups,View Count,Crosspost Parent List - Subdreddit(s)
jbker3,Pennsylvania Postal Worker Charged with Dumping Mail Is QAnon Follower: Report,,Qult_Headquarters,https://www.newsweek.com/postal-worker-mail-qanon-pittsburgh-conspiracy-1539322,0.97,False,,,,/r/Qult_Headquarters/comments/jbker3/pennsylvania_postal_worker_charged_with_dumping/,32652,,,t2_gfvhh,False,False,0,41,,
jbha1s,Hasanabi goes to a qanon rally ft all gas no brakes,,Qult_Headquarters,https://youtu.be/ovj4R9fuAKQ,0.92,False,youtube.com,,Undercover at Save The Children Rally,/r/Qult_Headquarters/comments/jbha1s/hasanabi_goes_to_a_qanon_rally_ft_all_gas_no/,32652,,,t2_5m1v7tfo,False,False,0,29,,
jbefpa,Articles about what prepared popular opinion to accept QAnon,"Below is are articles that explain how pseudoscience helped prepare public for QAnon.  Time Magazine Wonders Where Voters' Demon Pedophile Fears Come From by Jason Colavito  [http://www.jasoncolavito.com/blog/time-magazines-wonders-where-voters-demon-pedophile-fears-come-from](http://www.jasoncolavito.com/blog/time-magazines-wonders-where-voters-demon-pedophile-fears-come-from)  and Q-Anon, David Wilcock, and the Rise of a New Right-Wing Populist Religion  [http://www.jasoncolavito.com/blog/q-anon-david-wilcock-and-the-rise-of-a-new-right-wing-populist-religion](http://www.jasoncolavito.com/blog/q-anon-david-wilcock-and-the-rise-of-a-new-right-wing-populist-religion)  More articles at [http://www.jasoncolavito.com/apps/search?q=QAnon](http://www.jasoncolavito.com/apps/search?q=QAnon)",Qult_Headquarters,https://www.reddit.com/r/Qult_Headquarters/comments/jbefpa/articles_about_what_prepared_popular_opinion_to/,1.0,False,,,,/r/Qult_Headquarters/comments/jbefpa/articles_about_what_prepared_popular_opinion_to/,32652,,,t2_8hazeeg8,False,False,0,1,,
jbebuo,"Obama just said Qanon is ""seeping into the mainstream of the Republican Party"" on Pod Saves America",,Qult_Headquarters,https://www.reddit.com/r/Qult_Headquarters/comments/jbebuo/obama_just_said_qanon_is_seeping_into_the/,0.98,False,,,,/r/Qult_Headquarters/comments/jbebuo/obama_just_said_qanon_is_seeping_into_the/,32652,,,t2_q3kt7,False,False,0,659,,
jbe7wd,How To Spot A QAnon Member In Your Neighborhood,,Qult_Headquarters,https://i.redd.it/ustlnxbjw5t51.jpg,0.87,False,,,,/r/Qult_Headquarters/comments/jbe7wd/how_to_spot_a_qanon_member_in_your_neighborhood/,32652,,,t2_4rrga6uk,False,False,0,49,,
jb7zfe,Navy SEAL who says he killed bin Laden pushes back after Trump amplifies unfounded QAnon claims that the operation was a hoax and bin Laden is still alive,,Qult_Headquarters,https://thehill.com/policy/defense/521030-navy-seal-who-says-he-killed-bin-laden-pushes-back-after-trump-amplifies,0.98,False,,,,/r/Qult_Headquarters/comments/jb7zfe/navy_seal_who_says_he_killed_bin_laden_pushes/,32652,,,t2_612zd,False,False,0,72,,
jb441i,TMW - You're a Trump sycophant and ex-Navy SEAL from Team 6 who killed UBL and you find out you're dead and you killed a fake because your Commander in Chief is tweeting Qanon conspiracy theories,,Qult_Headquarters,https://i.redd.it/m2ec8rxu73t51.png,0.99,False,,,,/r/Qult_Headquarters/comments/jb441i/tmw_youre_a_trump_sycophant_and_exnavy_seal_from/,32652,,,t2_eg1rd,False,False,0,80,,
jb3iik,USPS Special Agents Raided Home of QAnon-aligned Mail Carrier Who Allegedly Hoarded and Threw Out Several Bags of Undelivered Mail,,Qult_Headquarters,https://lawandcrime.com/2020-election/usps-special-agents-raided-home-of-qanon-aligned-mail-carrier-who-allegedly-hoarded-and-threw-out-several-bags-of-undelivered-mail/,0.95,False,,,,/r/Qult_Headquarters/comments/jb3iik/usps_special_agents_raided_home_of_qanonaligned/,32652,,,t2_1y5tnhwq,False,False,0,63,,
jb3i9u,Great interview about Qanon with Frederick Brennan of 8chan/8kun,,Qult_Headquarters,https://podcasts.apple.com/us/podcast/reply-all/id941907967?i=1000491740644,0.96,False,,,,/r/Qult_Headquarters/comments/jb3i9u/great_interview_about_qanon_with_frederick/,32652,,,t2_bfn7qk2,False,False,0,19,,
jb2uke,Italian news producer looking for QAnon adherent / family,"Hi everyone,     I’m a news producer for Sky Tg24, the main 24/7 all news Italian channel and NBC sister Company. We are preparing a special program for the Us election night on November 3rd. We will invite several guests to comment together the results, but also to try to understand better the social and political climate in America during these difficult times. This is the reason why we’re trying to put together a multiform and varied group of guests who may bring interesting and different perspectives, not only journalists and experts, but real people who live in this Country.  We are hearing about QAnon on the news, but we would like to talk to some QAnon adherent that could tell us what this movement is about. Is there anyone you know that may be interested in taking part to our program (through a Zoom connection of course) and sharing his personal experience?  Thanks in advance for your help!  E.",Qult_Headquarters,https://www.reddit.com/r/Qult_Headquarters/comments/jb2uke/italian_news_producer_looking_for_qanon_adherent/,0.81,False,,,,/r/Qult_Headquarters/comments/jb2uke/italian_news_producer_looking_for_qanon_adherent/,32652,,,t2_6y959r9o,False,False,0,6,,
jazpja,Pittsburgh-area mail carrier under investigation is apparent QAnon conspiracy theorist,,Qult_Headquarters,https://www.pghcitypaper.com/pittsburgh/pittsburgh-area-mail-carrier-under-investigation-is-apparent-qanon-conspiracy-theorist/Content?oid=18171888,0.99,False,,,,/r/Qult_Headquarters/comments/jazpja/pittsburgharea_mail_carrier_under_investigation/,32652,,,t2_c1e0v,False,False,0,483,,
jaws5d,"You're making me mad, so I'm going to call you a pedophile! [RANT]","Something, I've noticed with the qultists that *really* ticks me off is they use the word ""pedophile"" not as a serious accusation, but as a way to slander their enemies. I was in a heated debate with this Trump supporter/QAnon and I backed him into a corner to the point where he just broke down and called me a pedophile lol. Keep in mind, we weren't even talking about sexual assault. He was trying to argue that Trump had done more for black people than any other president and I rebutted this by saying he's done irreversible damage to the black community with a.) 200 staunch conservative judge appointments (only 8 of whom were black), b.) loosening environmental regulations in black neighborhoods, and c.) actively seeking to end racial sensitivity training and education on black history. None of this had ANYTHING to do with pedophilia or sexual assault at all, yet when faced with overwhelming evidence that Trump is a horribly bigoted man, he called me a ""satanic democrat pedophile.""   It's the semantics of it all that really angers me. I'm deeply invested in helping victims of sexual abuse and sexual assault, so the word ""rapist"" or ""pedophile"" shouldn't be something you throw around like ""idiot"" or ""moron."" Being a pedophile isn't an insult. It's a serious accusation that shouldn't be thrown around lightly and should be reserved for victims of sexual abuse or witnesses of said abuse.   I think it's disgusting how they're wearing out the word ""pedophile"" because I fear it will soon be taken as lightly as ""idiot"" is which is very damaging to victims of ACTUAL pedophiles.",Qult_Headquarters,https://www.reddit.com/r/Qult_Headquarters/comments/jaws5d/youre_making_me_mad_so_im_going_to_call_you_a/,1.0,False,,,,/r/Qult_Headquarters/comments/jaws5d/youre_making_me_mad_so_im_going_to_call_you_a/,32652,,,t2_46nurk4d,False,False,0,132,,
javuzr,"Is anyone on Quora? There are numerous people asking innocent enough questions and sure enough, the Qultists are in there answering them with their mindless drivel.","I'm sorry if this isn't allowed. But I stumbled across the question in a search and had to jump in. The question: [Why is Qanon more dangerous than other conspiracies](https://www.quora.com/Why-are-QAnon-believers-more-dangerous-than-any-other-conspiracy-theorists)?  Of course the Qultists on this and other questions are saying things like: a military expert is telling you to ask questions, that's dangerous?....etc. Ugh. They are cunning and baffling, and persistent.",Qult_Headquarters,https://www.reddit.com/r/Qult_Headquarters/comments/javuzr/is_anyone_on_quora_there_are_numerous_people/,0.89,False,,,,/r/Qult_Headquarters/comments/javuzr/is_anyone_on_quora_there_are_numerous_people/,32652,,,t2_12gpcp,False,False,0,16,,
jatjei,TikTok Fails to Stop the Spread of QAnon Conspiracies on its Platform,,Qult_Headquarters,https://www.isdglobal.org/digital_dispatches/tiktok-fails-to-stop-spread-of-qanon-conspiracy/,0.9,False,,,,/r/Qult_Headquarters/comments/jatjei/tiktok_fails_to_stop_the_spread_of_qanon/,32652,,,t2_polr8,False,False,0,13,,
jaq28n,The conspiracy to end all Q theories,"Just using their same logic turned around, what if the “elite” are the masterminds behind the Qanon movement because they BENEFIT the MOST from conservative policy and capitalism, obviously. They are using the most evil of evil propaganda to play on the heart strings of masses and sell them a patriot hero and freedom narrative to get them to fight for their cause while they get to sit back and watch the “show.” They get to keep their riches and power and have the working class not only working for them physically (and pay them minimally) but also politically. I know not to fight fire with fire and that Qs are so deep in thier rabbit hole they won’t climb out to see anything other than what is inside their vortex, but… ugh just venting because I don’t want to bring this up to my Q as to not open pandora’s box.",Qult_Headquarters,https://www.reddit.com/r/Qult_Headquarters/comments/jaq28n/the_conspiracy_to_end_all_q_theories/,0.94,False,,,,/r/Qult_Headquarters/comments/jaq28n/the_conspiracy_to_end_all_q_theories/,32652,,,t2_7ex21rfi,False,False,0,23,,
japfno,I got to sit down with the boys from QAA for Episode 113 where we discussed the Facebook ban of QAnon,[https://soundcloud.com/qanonanonymous/episode-113-the-second-qanon-purge-mutation-feat-marc-andre-argentino](https://soundcloud.com/qanonanonymous/episode-113-the-second-qanon-purge-mutation-feat-marc-andre-argentino),Qult_Headquarters,https://www.reddit.com/r/Qult_Headquarters/comments/japfno/i_got_to_sit_down_with_the_boys_from_qaa_for/,0.91,False,,,,/r/Qult_Headquarters/comments/japfno/i_got_to_sit_down_with_the_boys_from_qaa_for/,32652,,,t2_polr8,False,False,0,28,,
jaoinz,"The president retweeted an insane article alleging ""Biden and Obama may have had Seal Team 6 killed"" posted by a QAnon account and written by ""an ex-Community Organizer and Homeschool Mom.""",,Qult_Headquarters,https://twitter.com/UrbanAchievr/status/1316118694385385473,0.99,False,twitter.com,https://twitter.com/UrbanAchievr/status/1316118694385385473,,/r/Qult_Headquarters/comments/jaoinz/the_president_retweeted_an_insane_article/,32652,,,t2_hhq3wyu,False,False,2,560,,
jankv9,Pittsburgh-area mail carrier under investigation is apparent QAnon conspiracy theorist,,Qult_Headquarters,https://www.pghcitypaper.com/pittsburgh/pittsburgh-area-mail-carrier-under-investigation-is-apparent-qanon-conspiracy-theorist/Content?oid=18171888,0.97,False,,,,/r/Qult_Headquarters/comments/jankv9/pittsburgharea_mail_carrier_under_investigation/,32652,,,t2_4w8ovur8,False,False,0,67,,
jal6r2,QAnon Fans Try To Explain Why Trump Took a Drug Developed with Fetal Tissue,,Qult_Headquarters,https://www.vice.com/en/article/4ayk5p/qanon-fans-try-to-explain-why-trump-took-a-drug-developed-with-fetal-tissue,1.0,False,,,,/r/Qult_Headquarters/comments/jal6r2/qanon_fans_try_to_explain_why_trump_took_a_drug/,32652,,,t2_hhq3wyu,False,False,0,156,,
jahdrz,QAnon peeps are sharing a scientifically-based video on FB and are clueless it provides valid reasons for wearing a face mask!!!,"I generally check out info my family is sharing on FB—just to gauge how far down the rabbit hole they’ve traveled.  I was literally jumping for joy yesterday morning when they shared a YouTube video titled “The Untold Truth Behind Face Masks and COVID-19”—there is no doubt in my mind that they relied on the title and the first 3:00 minutes of the video to vet it as QAnon-appropriate.  The first three minutes did indeed provide them with fodder from the 1918 Spanish flu pandemic to fire up plenty of anti-mask rhetoric—but, it was based on what the scientific community knew 100+ years ago.  Had they watched the remaining 25 minutes of the video, they would have learned:  1-face mask material matters  2-how to wear a mask correctly   3-mask hygiene practices   4-how to properly remove a mask  5-the benefits of wearing a mask  Key scientific highlights was [provided by:](https://ccdd.hsph.harvard.edu/people/michael-mina/)  &gt;Dr. Michael Mina, MD, PhD is an Assistant Professor of Epidemiology at Harvard T. H. Chan School of Public Health and a core member of the Center for Communicable Disease Dynamics (CCDD). He is additionally an Assistant Professor in Immunology and Infectious Diseases at HSPH and Associate Medical Director in Clinical Microbiology (molecular diagnostics) in the Department of Pathology at Brigham and Women’s Hospital, Harvard Medical School.  As disheartening as it has been to watch my family fall into the QAnon void—yesterday morning provided a ray of hope that perhaps somebody in their cult might watch the entire video..",Qult_Headquarters,https://www.reddit.com/r/Qult_Headquarters/comments/jahdrz/qanon_peeps_are_sharing_a_scientificallybased/,0.98,False,,,,/r/Qult_Headquarters/comments/jahdrz/qanon_peeps_are_sharing_a_scientificallybased/,32652,,,t2_3rg2x,False,False,0,79,,
jag9xq,Logically Investigation Uncovers QAnon Central Hub Hosting Phishing Scams; Direct Ties to Jim Watkins,,Qult_Headquarters,https://www.logically.ai/articles/exclusive-logically-investigation-uncovers-qanon-central-hub-hosting-phishing-scams-direct-ties-to-jim-watkins,1.0,False,,,,/r/Qult_Headquarters/comments/jag9xq/logically_investigation_uncovers_qanon_central/,32652,,,t2_4w8ovur8,False,False,1,498,,
jaff3i,Here is a Website that is Perpetuating Qanon Beliefs and Capitalizing on Our Lost Q's,"I posted about this before but did not list the FB page because it is under the name of a person and I did not want to get into trouble or violate Reddit policies. This is a site my Q follows.  However, here is the website for the products  they sell:  [ https://essentialmbs.com/](https://essentialmbs.com/)   \*\*You can link to the Facebook page from the website.  I have reported this site previously, but it is still up.  This is a site that posts ""mystical"" messages, and encourages followers to separate from those who do not believe or follow. It does not mention Qanon, but many of the posts address and support Qanon beliefs. I have attached two recent post memes to portray how it encourages to separate from those of us who are not ""awake.""  Note: This site has a lot of followers and cleverly promotes the products it sells. (what a crappy way to drum up business, preying on vulnerable people under the guise of mysticism)  https://preview.redd.it/epkf9qqsovs51.png?width=319&amp;format=png&amp;auto=webp&amp;s=e1b5041dab6249d2d517b3f2471cb378f99be48d  https://preview.redd.it/qoae1xqsovs51.png?width=649&amp;format=png&amp;auto=webp&amp;s=4497918dfd52cfbbddf3100f0ef5fcc75c97cbe5",Qult_Headquarters,https://www.reddit.com/r/Qult_Headquarters/comments/jaff3i/here_is_a_website_that_is_perpetuating_qanon/,0.92,False,,,,/r/Qult_Headquarters/comments/jaff3i/here_is_a_website_that_is_perpetuating_qanon/,32652,,,t2_7v15vrgb,False,False,0,26,,
jaecmu,First hand evidence of Michigan governor kidnapping plotters' involvement with QAnon?,"I'm wondering if there is a source that shows evidence of the Wolverine Watchmen (men who had plotted to kidnap the Michigan governor) involvement with QAnon. I'm looking specifically for primary source evidence (e.g., screenshot of FB post). Thank you!",Qult_Headquarters,https://www.reddit.com/r/Qult_Headquarters/comments/jaecmu/first_hand_evidence_of_michigan_governor/,0.9,False,,,,/r/Qult_Headquarters/comments/jaecmu/first_hand_evidence_of_michigan_governor/,32652,,,t2_7q7s22xx,False,False,0,8,,
ja8179,What's behind the rise of QAnon in the UK?,,Qult_Headquarters,https://www.bbc.com/news/blogs-trending-54065470,0.85,False,,,,/r/Qult_Headquarters/comments/ja8179/whats_behind_the_rise_of_qanon_in_the_uk/,32652,,,t2_c1e0v,False,False,0,12,,
ja1diy,YouTube CEO won't commit to banning QAnon content,,Qult_Headquarters,https://www.independent.co.uk/news/world/americas/youtube-qanon-policies-removal-susan-wojcicki-cnn-b998369.html,0.94,False,,,,/r/Qult_Headquarters/comments/ja1diy/youtube_ceo_wont_commit_to_banning_qanon_content/,32652,,,t2_1203qd,False,False,0,37,,
j9vhx6,Martha McSally spoke at an event with QAnon conspiracy theorist and anti-masker Daniel Wood,,Qult_Headquarters,https://www.mediamatters.org/qanon-conspiracy-theory/martha-mcsally-spoke-event-qanon-conspiracy-theorist-and-anti-masker-daniel,1.0,False,,,,/r/Qult_Headquarters/comments/j9vhx6/martha_mcsally_spoke_at_an_event_with_qanon/,32652,,,t2_4w8ovur8,False,False,0,12,,
j9u464,Let's be honest Facebook's claim they are pulling Qanon content is bullshit,"There is still plenty of it on Facebook, they have not created anyway for you to report it as Qanon propaganda, and if you do try and report it they just reply back and say thanks for reporting it but it does not violate community standards.",Qult_Headquarters,https://www.reddit.com/r/Qult_Headquarters/comments/j9u464/lets_be_honest_facebooks_claim_they_are_pulling/,0.99,False,,,,/r/Qult_Headquarters/comments/j9u464/lets_be_honest_facebooks_claim_they_are_pulling/,32652,,,t2_eg1rd,False,False,0,64,,
j9tsi2,What will happen to QAnon if Trump loses?,"Hey, everyone. I’m writing a series on QAnon and my next piece is contemplating the future of QAnon if Trump loses in November (which is looking increasingly likely).   I think most of us would agree that QAnon will continue without Trump. The foundational belief in a powerful, underground cabal of deep state pedophiles doesn’t really need Trump and actually dates back a century if we go all the way back to The Protocols of the Elders of Zion.   But I’m wondering *how* QAnon will continue when Trump, their figurehead, no longer has the power to fight the cabal. Will they argue that he does and he’s doing it in the background now that he’s no longer POTUS? Will the movement jettison Trump and cling to a different QAnon politician like Marjorie Taylor Greene? Will JFK Jr become a stand in figurehead for a while? Will the movement turn away from Q to a different Anon sharing alleged information on the deep state?  Does anyone know if Q followers have been discussing such a backup plan? So far, the main line appears to be that the polls are fake and Trump will easily win come Election Day. I’ve sensed some doubt in the communities I’m following, but it appears this is still the dominant line. Has anyone seen anything different? And if you haven’t, what’s your theory on what will happen to QAnon if Trump loses?",Qult_Headquarters,https://www.reddit.com/r/Qult_Headquarters/comments/j9tsi2/what_will_happen_to_qanon_if_trump_loses/,0.96,False,,,,/r/Qult_Headquarters/comments/j9tsi2/what_will_happen_to_qanon_if_trump_loses/,32652,,,t2_i6uq0,False,False,0,29,,
j9smhg,"Following an Etsy ban, QAnon merch is still readily available on online marketplaces",,Qult_Headquarters,https://www.glossy.co/fashion/following-an-etsy-ban-qanon-merch-is-still-readily-available-on-online-marketplaces/,1.0,False,,,,/r/Qult_Headquarters/comments/j9smhg/following_an_etsy_ban_qanon_merch_is_still/,32652,,,t2_66c5625d,False,False,0,12,,
j9rgs3,"My parents/stepmom might be getting into Qanon, can I do anything to help keep them out?","My family is VERY conservative so that already puts a moratorium on how much I can talk or even interact with them, but I'm worried that with the pandemic and my mom's retirement, with more time they get to spend at home on the internet, that they're beginning to espouse qanon-adjacent views.  I see my mom about once a week, and what I do whenever she turns on conservative radio is I put SciShow on the TV with the channel on autoplay, but louder.  It at least gets her attention and keeps her out of the mess for a few hours and she doesn't know how to work the TV that well so if I forget to change it from the roku back to the TV she has to deal with science, but it's only once a week and she's on facebook ALL THE TIME.  My stepmom and dad are a little bit of a different story.  My stepmom is really into crystals and American Indian spirituality (she's white as white can be and has NO PLACE in any tribal religions or traditions).  She's also dealt with a lot of confirmed medical malpractice during her life and doesn't trust doctors a ton, so through that she's started getting into antivax stuff.  I know antivax is a gateway to qanon now and I want to like lock that gate before she and my dad get radicalized.  I don't see them as often because they live further away and my relationship with my dad is more strained.    My dad has a lot of mental health issues and all three of them really hate antifa and blm, to the point where they will yell at me (in person) over things I post on social media even vaguely alluding to support for those movements.  Does anyone have any advice for keeping them from going down those paths?  I honestly got along better with my stepmom than either of my parents for a long time, and I don't want to have to cut any of them out of my life again, but I don't think it would be safe for me to be around that sort of ideology.",Qult_Headquarters,https://www.reddit.com/r/Qult_Headquarters/comments/j9rgs3/my_parentsstepmom_might_be_getting_into_qanon_can/,0.6,False,,,,/r/Qult_Headquarters/comments/j9rgs3/my_parentsstepmom_might_be_getting_into_qanon_can/,32652,,,t2_3aub30o4,False,False,0,1,,
j9r773,What if QAnon is just shitposting?,"Considering the places in which Q usually posted, and currently posts, his bs (4chan, 8chan and 8kun)... Could this QAnon mess be just a giant trolling operation? Could this great Q Patriot be just the greatest troll of our time?  Because it's just too absurd... the QClock research reminds me of the ""Look down-look up-look at your left"" memes. He didn't post on Wikileaks, or in other whistleblowing platforms... He's just posting bs on 8kun, a place populated by shitposters.  Since I began my research on QAnon for my graduation thesis I got this question searing through my mind. Hope I'm not the only one.",Qult_Headquarters,https://www.reddit.com/r/Qult_Headquarters/comments/j9r773/what_if_qanon_is_just_shitposting/,1.0,False,,,,/r/Qult_Headquarters/comments/j9r773/what_if_qanon_is_just_shitposting/,32652,,,t2_5j6ryrc0,False,False,0,14,,
j9qmpt,An article about QAnon from the MIT website. Guess it might be useful to someone.,,Qult_Headquarters,https://jods.mitpress.mit.edu/pub/tliexqdu/release/4,1.0,False,,,,/r/Qult_Headquarters/comments/j9qmpt/an_article_about_qanon_from_the_mit_website_guess/,32652,,,t2_5j6ryrc0,False,False,0,9,,
j9p8ez,QAnon is tearing families apart,,Qult_Headquarters,https://www.washingtonpost.com/technology/2020/09/14/qanon-families-support-group/,0.99,False,,,,/r/Qult_Headquarters/comments/j9p8ez/qanon_is_tearing_families_apart/,32652,,,t2_4w8ovur8,False,False,0,217,,
j9gnfl,Tom Hanks trolls Qanon by playing a child trafficker in his latest film.,,Qult_Headquarters,https://www.youtube.com/watch?v=DC4yeO5SdCE,0.96,False,youtube.com,,NEWS OF THE WORLD Official Trailer (2020) Tom Hanks Movie HD,/r/Qult_Headquarters/comments/j9gnfl/tom_hanks_trolls_qanon_by_playing_a_child/,32652,,,t2_16q51r,False,False,0,66,,
j9e8kc,QAnon Is Thriving in Germany. The Extreme Right Is Delighted.,,Qult_Headquarters,https://www.nytimes.com/2020/10/11/world/europe/qanon-is-thriving-in-germany-the-extreme-right-is-delighted.html,0.9,False,,,,/r/Qult_Headquarters/comments/j9e8kc/qanon_is_thriving_in_germany_the_extreme_right_is/,32652,,,t2_gfvhh,False,False,0,29,,
j9e64b,Here's What Banning QAnon From Facebook Will Do ... And What It's Probably Too Late To Do,,Qult_Headquarters,https://www.wonkette.com/heres-what-banning-qanon-from-facebook-will-do-and-what-its-probably-too-late-to-do,0.7,False,,,,/r/Qult_Headquarters/comments/j9e64b/heres_what_banning_qanon_from_facebook_will_do/,32652,,,t2_5qgin,False,False,0,5,,
j99gxe,Family turned Qultists,"Idk if this belongs here, but I feel like I’m in a unique position here. I’m 19 y/o and still live with my parents and sister. They have all recently fell into the Q hole, except for me. Usually it’s the Qnuts who alienate themselves, but since my entire family believes it I’m the one who’s “insane”. Is anyone else in a similar situation? How do you deal when your parents are trying to tell you Michelle Obama has a penis and your sister is trying to tell you Frazzle Drip is real? I’ve looked up to these people my whole life, and Qanon ruined their sanity. It’s extremely depressing. I miss my real mom.",Qult_Headquarters,https://www.reddit.com/r/Qult_Headquarters/comments/j99gxe/family_turned_qultists/,0.91,False,,,,/r/Qult_Headquarters/comments/j99gxe/family_turned_qultists/,32652,,,t2_l7tih,False,False,0,21,,
