ID,Title,Text,Subreddit,URL,Upvote Ratio,Media Only,Media Type,Media URL,Media Title,Permalink,Subreddit Subscribers,Report ReasonsRemoval Reasons,Author,Is Original Content,Is Crosspostable,Num Crossposts,Ups,View Count,Crosspost Parent List - Subdreddit(s)
iznkqh,BLM a Marxist Group,"I’ve been apart of this sub for awhile and maybe I missed this discussion. How come Qcumbers believe that the BLM organization is a Marxist group? Why is George Soros evil? I’m confused about this whole thing. The right claims to be “Christians”, but they don’t see any wrong in how minorities are being treated in society. I get it it’s not everywhere, but history has shown us that equal just is not for everyone. I probably went off topic but I’m trying truly trying to understand what’s wrong with BLM? Any thoughts?",Qult_Headquarters,https://www.reddit.com/r/Qult_Headquarters/comments/iznkqh/blm_a_marxist_group/,0.88,False,,,,/r/Qult_Headquarters/comments/iznkqh/blm_a_marxist_group/,32634,,,t2_3nl8z0xw,False,False,0,30,,
iz2cl1,u/CardboardChampion gives a concise insight into QAnon's motivations,,Qult_Headquarters,https://www.reddit.com/r/insanepeoplefacebook/comments/iyuo70/made_the_mistake_of_searching_wwg1wga_dont_do_that/g6ewska,0.86,False,,,,/r/Qult_Headquarters/comments/iz2cl1/ucardboardchampion_gives_a_concise_insight_into/,32634,,,t2_fwuxr,False,False,0,10,,
iz16j6,The Podcast 'Reply All' just had a really good episode on the history of Qanon,"https://gimletmedia.com/shows/reply-all  It's not a podcast I normally listen to but was recommended it from another one. This episode is really good and includes and interview with Frederick Brennan. It is abundantly clear that the Watkins's are either Q himself or at least working with whoever the guy is, but it also seems clear that the handle has changed hands.",Qult_Headquarters,https://www.reddit.com/r/Qult_Headquarters/comments/iz16j6/the_podcast_reply_all_just_had_a_really_good/,1.0,False,,,,/r/Qult_Headquarters/comments/iz16j6/the_podcast_reply_all_just_had_a_really_good/,32634,,,t2_59nla,False,False,0,25,,
iz01qi,The Q Origins Project: a Twitter account that discusses early QAnon in its original context as one of many conspiracy theory LARPers on 4chan /pol/,,Qult_Headquarters,https://twitter.com/QOrigins,0.95,False,,,,/r/Qult_Headquarters/comments/iz01qi/the_q_origins_project_a_twitter_account_that/,32634,,,t2_qydgecn,False,False,0,63,,
iyqfft,"Spiritual Qultists: ""Trump is a light worker"" &amp; ""Where we go 1 wigga wogga all"" &amp; ""Thanks indigenous peoples for plant medicine"" ... hypocrisy and irony",,Qult_Headquarters,https://www.facebook.com/watch/?v=1218834841821460,0.89,False,,,,/r/Qult_Headquarters/comments/iyqfft/spiritual_qultists_trump_is_a_light_worker_where/,32634,,,t2_7i6uuw6n,False,False,0,20,,
iypfpj,Could a storm actually be coming?,"Mass arrests. Military occupation. Trump declaring himself dictator. Civil war.  They were ridiculous fantasies, not worthy of consideration. I’m afraid that may be changing.  Trump will never leave office peacefully if he loses. We’ve long suspected it, and he’s now basically confirmed it.  We’ve already seen him gas protesters so he could take a walk to fake being a brave Christian. We’ve heard him say he wants to “dominate the streets.” We’ve heard him openly encourage police brutality. We know all about him extorting other countries and cooperating with our enemies to benefit himself politically.   I have no doubt as to his willingness to use ANY means to not lose power.   Of course this “storm” will have nothing to do with satanic pedophiles or a deep state conspiracy. But their prediction of what is going to happen might not be far off.  He’s talking about destroying ballots if he loses. His campaign is talking about using state legislators In swing states to select electors that will vote to re-elect Trump against the will of of the voters.  If these things fail, what’s to stop him from giving himself emergency powers and refusing to leave? Or using violence against civilians/government officials? Or occupying the streets with secret police, crushing any sign of dissent? He even has a fanatical, brainwashed Qult that will commit any terrorist act he tells them to.   Are these things plausible? I feel like they are. I want to be wrong. Please tell me why I am wrong.",Qult_Headquarters,https://www.reddit.com/r/Qult_Headquarters/comments/iypfpj/could_a_storm_actually_be_coming/,0.86,False,,,,/r/Qult_Headquarters/comments/iypfpj/could_a_storm_actually_be_coming/,32634,,,t2_773g1k0i,False,False,0,23,,
iyp1ob,Qultists are going to have a field day with this: The Trump campaign is reportedly 'discussing contingency plans to bypass election results',,Qult_Headquarters,https://news.yahoo.com/trump-campaign-reportedly-discussing-contingency-153100735.html,0.99,False,,,,/r/Qult_Headquarters/comments/iyp1ob/qultists_are_going_to_have_a_field_day_with_this/,32634,,,t2_obf65,False,False,0,449,,
iyng6v,"It's A Fallacy to Say QAnon is False. The Real Question is, How Much Is True?",,Qult_Headquarters,https://i.redd.it/w6tsd64100p51.jpg,0.28,False,,,,/r/Qult_Headquarters/comments/iyng6v/its_a_fallacy_to_say_qanon_is_false_the_real/,32634,,,t2_4qkx,False,False,0,0,,
iykyry,I’m having a tough time keeping up with my friends Qposting. Can anyone give me some help coming back to this. ItsIt's coming. He’s coming out with it more and more recently!,,Qult_Headquarters,https://i.redd.it/lo4us8xh6zo51.jpg,0.92,False,,,,/r/Qult_Headquarters/comments/iykyry/im_having_a_tough_time_keeping_up_with_my_friends/,32634,,,t2_26sp3cab,False,False,0,10,,
iygt3s,Q Drop 4750: A mashup of previous Q talking points,"[#NewQ #NewCue #StopItQ](https://preview.redd.it/ghqzxpqf5yo51.png?width=492&amp;format=png&amp;auto=webp&amp;s=41390884741001b3b282a2929bdd06d3ead1e65e)  Q, make the power or Internet go out in my house if you don't want me showing your drops to the anti-Q community.",Qult_Headquarters,https://www.reddit.com/r/Qult_Headquarters/comments/iygt3s/q_drop_4750_a_mashup_of_previous_q_talking_points/,0.88,False,,,,/r/Qult_Headquarters/comments/iygt3s/q_drop_4750_a_mashup_of_previous_q_talking_points/,32634,,,t2_6cjvnvjv,False,False,0,6,,
iygkn4,"Q Drop 4749: Q, your movement is considered a domestic threat.","[Define projection, Q.](https://preview.redd.it/o74wxqmr2yo51.png?width=493&amp;format=png&amp;auto=webp&amp;s=84617bfa5ba001c78041c81ded3cb4c8150f7bed)",Qult_Headquarters,https://www.reddit.com/r/Qult_Headquarters/comments/iygkn4/q_drop_4749_q_your_movement_is_considered_a/,0.9,False,,,,/r/Qult_Headquarters/comments/iygkn4/q_drop_4749_q_your_movement_is_considered_a/,32634,,,t2_6cjvnvjv,False,False,0,7,,
iygk92,17 Drop 4744: Just a link do an article about proposed legislation.,https://preview.redd.it/3exjfrru1yo51.png?width=494&amp;format=png&amp;auto=webp&amp;s=fe9ab534175b57352c348d4b25f3fe7390f65305,Qult_Headquarters,https://www.reddit.com/r/Qult_Headquarters/comments/iygk92/17_drop_4744_just_a_link_do_an_article_about/,1.0,False,,,,/r/Qult_Headquarters/comments/iygk92/17_drop_4744_just_a_link_do_an_article_about/,32634,,,t2_6cjvnvjv,False,False,0,3,,
iygk1g,Cue Drop 4743: Just a catchphrase,https://preview.redd.it/o5hf4zia3yo51.png?width=492&amp;format=png&amp;auto=webp&amp;s=0cf542090dfeacb425c30c5fcecf25a753a71b3d,Qult_Headquarters,https://www.reddit.com/r/Qult_Headquarters/comments/iygk1g/cue_drop_4743_just_a_catchphrase/,1.0,False,,,,/r/Qult_Headquarters/comments/iygk1g/cue_drop_4743_just_a_catchphrase/,32634,,,t2_6cjvnvjv,False,False,0,6,,
iyd5f5,Can we classify OAN as a QAnon network?,"https://mobile.twitter.com/AlKapDC/status/1308793557541703687  Also, the JFK Jr. Lives emoji might not sit well with the mainline Qultists.",Qult_Headquarters,https://www.reddit.com/r/Qult_Headquarters/comments/iyd5f5/can_we_classify_oan_as_a_qanon_network/,0.99,False,,,,/r/Qult_Headquarters/comments/iyd5f5/can_we_classify_oan_as_a_qanon_network/,32634,,,t2_6cjvnvjv,False,False,0,68,,
iyce2y,Get your toilet rolls ready! A solar flash to hit Earth on December 21st and cause the 3d/5d split! Woohoooo wiggawaggaploop!,,Qult_Headquarters,https://i.redd.it/2uu236lf2xo51.jpg,1.0,False,,,,/r/Qult_Headquarters/comments/iyce2y/get_your_toilet_rolls_ready_a_solar_flash_to_hit/,32634,,,t2_71wfelmf,False,False,0,21,,
iybxh0,"CBS “60 in 6” gets inside look at QAnon, speaks with a leader in the movement",,Qult_Headquarters,https://www.cbsnews.com/video/60-in-6-gets-inside-look-at-qanon-speaks-with-a-leader-in-the-movement/,0.92,False,,,,/r/Qult_Headquarters/comments/iybxh0/cbs_60_in_6_gets_inside_look_at_qanon_speaks_with/,32634,,,t2_3mmab,False,False,0,10,,
iya13l,"Austin Steinbart, currently imprisoned in Arizona, has released audio imploring his followers to meet him out front with a Delorean",,Qult_Headquarters,https://www.youtube.com/watch?v=ng1ByFISEac,0.93,False,youtube.com,,Prison Diaries - Ep1 - Initiation,/r/Qult_Headquarters/comments/iya13l/austin_steinbart_currently_imprisoned_in_arizona/,32634,,,t2_c5ns0,False,False,0,22,,
iy0v8l,Qultists think it was a work of God that Trump got elected in the first place...,"... but it was actually [Russian troll farms](https://www.businessinsider.com/russian-troll-farm-spent-millions-on-election-interference-2018-2), [Steve Bannon and Cambridge Analytica](https://www.theguardian.com/uk-news/2018/mar/23/leaked-cambridge-analyticas-blueprint-for-trump-victory), and some other familiar faces, surely.",Qult_Headquarters,https://www.reddit.com/r/Qult_Headquarters/comments/iy0v8l/qultists_think_it_was_a_work_of_god_that_trump/,0.87,False,,,,/r/Qult_Headquarters/comments/iy0v8l/qultists_think_it_was_a_work_of_god_that_trump/,32634,,,t2_7i6uuw6n,False,False,0,20,,
ixxlwl,I thought this new age Q blog was making a transition into being communist propaganda but it quickly transitioned back to word salad,,Qult_Headquarters,https://i.redd.it/w6c5urlzwro51.png,1.0,False,,,,/r/Qult_Headquarters/comments/ixxlwl/i_thought_this_new_age_q_blog_was_making_a/,32634,,,t2_49z11,False,False,0,20,,
ixwz5m,The Simon Wiesenthal Center released a report Tuesday detailing the origins of the QAnon conspiracy theory and warning about its anti-Semitic nature,,Qult_Headquarters,https://thehill.com/policy/technology/517648-jewish-human-rights-org-warns-about-threat-of-qanon,0.96,False,,,,/r/Qult_Headquarters/comments/ixwz5m/the_simon_wiesenthal_center_released_a_report/,32634,,,t2_612zd,False,False,0,53,,
ixtta6,Neo knew apparently. This was also with the heading when will people see this is not a coincidence. Which is exactly what it is to a sane person,,Qult_Headquarters,https://i.redd.it/cct69wv5yqo51.jpg,0.93,False,,,,/r/Qult_Headquarters/comments/ixtta6/neo_knew_apparently_this_was_also_with_the/,32634,,,t2_txarmru,False,False,0,41,,
ixtftl,National Catholic Prayer Breakfast to Award Barr — Does that make him a clone or added to the flight log?,,Qult_Headquarters,https://www.catholicnewsagency.com/news/ag-to-be-honored-at-virtual-catholic-prayer-breakfast-10978,0.94,False,,,,/r/Qult_Headquarters/comments/ixtftl/national_catholic_prayer_breakfast_to_award_barr/,32634,,,t2_7fvzgxxb,False,False,0,36,,
ixrqlv,"Martin Is a Leader In the Qanon Community, Also a Baby",,Qult_Headquarters,https://i.redd.it/rh3y3a7kfqo51.jpg,1.0,False,,,,/r/Qult_Headquarters/comments/ixrqlv/martin_is_a_leader_in_the_qanon_community_also_a/,32634,,,t2_2wk1zhzs,False,False,0,375,,
ixr7si,"A very wordy Austin meme, but it sums up the basic argument pretty well",,Qult_Headquarters,https://i.redd.it/9lkqy30uaqo51.jpg,0.93,False,,,,/r/Qult_Headquarters/comments/ixr7si/a_very_wordy_austin_meme_but_it_sums_up_the_basic/,32634,,,t2_1p67vq1k,False,False,0,36,,
ixpgos,Q Drop 4740: Just a link to a video of a literal stealth bomber,https://preview.redd.it/061vpjwd6ro51.png?width=488&amp;format=png&amp;auto=webp&amp;s=e3c94b5b8dd485390c734ecd2f2b585c234667fe  &amp;#x200B;,Qult_Headquarters,https://www.reddit.com/r/Qult_Headquarters/comments/ixpgos/q_drop_4740_just_a_link_to_a_video_of_a_literal/,1.0,False,,,,/r/Qult_Headquarters/comments/ixpgos/q_drop_4740_just_a_link_to_a_video_of_a_literal/,32634,,,t2_6cjvnvjv,False,False,0,15,,
ixmiun,"Researchers Made A QAnon AI Bot Because Things Aren't Already Bad Enough, Apparently",,Qult_Headquarters,https://www.gizmodo.com.au/2020/09/researchers-made-a-qanon-ai-bot-because-things-arent-already-bad-enough-apparently/,0.96,False,,,,/r/Qult_Headquarters/comments/ixmiun/researchers_made_a_qanon_ai_bot_because_things/,32634,,,t2_qydgecn,False,False,0,18,,
ixhpzv,"A Court Has Ordered A Conspiracy Theorist To Pay $875,000 For Defaming An Aussie Politician",,Qult_Headquarters,https://www.gizmodo.com.au/2020/09/a-court-ordered-a-conspiracy-theorist-to-pay-8750000-for-defaming-australian-politician/,0.98,False,,,,/r/Qult_Headquarters/comments/ixhpzv/a_court_has_ordered_a_conspiracy_theorist_to_pay/,32634,,,t2_c5ns0,False,False,0,110,,
ixddn0,Have you ever had an argument with a Q follower and “won” with facts and logic,[View Poll](https://www.reddit.com/poll/ixddn0),Qult_Headquarters,https://www.reddit.com/r/Qult_Headquarters/comments/ixddn0/have_you_ever_had_an_argument_with_a_q_follower/,0.8,False,,,,/r/Qult_Headquarters/comments/ixddn0/have_you_ever_had_an_argument_with_a_q_follower/,32634,,,t2_13y14v,False,False,0,6,,
ixam0a,Some really nice logic that a Q supporter I knew said.,“We should not remove confederate statues because they were American”. So with that logic it’s perfectly ok for Germany to have nazi statues because they were German.,Qult_Headquarters,https://www.reddit.com/r/Qult_Headquarters/comments/ixam0a/some_really_nice_logic_that_a_q_supporter_i_knew/,1.0,False,,,,/r/Qult_Headquarters/comments/ixam0a/some_really_nice_logic_that_a_q_supporter_i_knew/,32634,,,t2_3dl89xuj,False,False,0,14,,
ix8eeh,Was the Subreddit Pedogate A Front for CP Distribution?,"I’ve speculated that all along r/pedogate was merely a front for cp (child pornography) distribution. Considering how a ton of pro-Qanon people have ended up being pedophiles I think that in addition to political propaganda a large part of Qanon is a front for damaging the operations of child protective services, distributing cp, portray those against pedophilia as violent alt-righters, and using reverse psychology to revive pro pedophile movements and create sympathy for pedophiles. I hear that pedogate had links to cp images and I speculate that in order to avoid being arrested pedophiles create fake subreddits dedicated to “exposing” pedophiles and claim if they’re caught with cp that it’s part of defeating pedophiles. I think that in addition to political propagandists who operate by smearing, there is also a large presence of pedophilia in certain factions of Qanon.  I’ve had people who looked very deep into Qanon tell me that Qanon boards have cp on them. Why is a movement that claims to be taking down an alleged network of pedophiles end up being a network of pedophiles itself? It seems like the parts of Qanon dedicated to “fighting” pedophiles are simply pedophile networks that operate under the guise of taking down pedophile rings. Either to avoid arrest when caught with cp or the reverse psychology listed above.  What are your thoughts on this?",Qult_Headquarters,https://www.reddit.com/r/Qult_Headquarters/comments/ix8eeh/was_the_subreddit_pedogate_a_front_for_cp/,0.8,False,,,,/r/Qult_Headquarters/comments/ix8eeh/was_the_subreddit_pedogate_a_front_for_cp/,32634,,,t2_df3u0ve,False,False,0,11,,
ix6k2w,"I mean, it could be a clone.",,Qult_Headquarters,https://i.redd.it/f2b5fna6rjo51.jpg,0.98,False,,,,/r/Qult_Headquarters/comments/ix6k2w/i_mean_it_could_be_a_clone/,32634,,,t2_py25f5k,False,False,0,31,,
ix4638,QAnons or the Nazis? A quiz,,Qult_Headquarters,https://i.redd.it/d4dixbvq5jo51.jpg,0.98,False,,,,/r/Qult_Headquarters/comments/ix4638/qanons_or_the_nazis_a_quiz/,32634,,,t2_5urzrr0j,False,False,0,126,,
iwyqdw,Those who joined the Qult due to religious motivations should deeply think about this line from a Kendrick Lamar song,"&gt; They say if you scared, go to church  &gt; But remember, he knows the Bible too  ""He"" as in the devil, of course.  — [For Sale? (Interlude) - Kendrick Lamar (To Pimp a Butterfly)](https://www.youtube.com/watch?v=Xhni3p4yfPA)  Such a beautiful song. I think it's Thundercat on bass, killing it!",Qult_Headquarters,https://www.reddit.com/r/Qult_Headquarters/comments/iwyqdw/those_who_joined_the_qult_due_to_religious/,0.5,False,,,,/r/Qult_Headquarters/comments/iwyqdw/those_who_joined_the_qult_due_to_religious/,32634,,,t2_7i6uuw6n,False,False,0,0,,
iwx3zt,QAnon conspiracists believe in a vast pedophile ring. The truth is sadder | QAnon,,Qult_Headquarters,https://www.theguardian.com/commentisfree/2020/sep/20/qanon-conspiracy-child-abuse-truth-trump,0.88,False,,,,/r/Qult_Headquarters/comments/iwx3zt/qanon_conspiracists_believe_in_a_vast_pedophile/,32634,,,t2_4w8ovur8,False,False,0,23,,
iwuz9d,Q (former) has discovered a REAL prophet!!!,,Qult_Headquarters,https://www.youtube.com/watch?v=UFa2b56_SHY&amp;feature=youtu.be,0.81,False,youtube.com,,Original Q (Coleman Rogers) discovers a real prophet,/r/Qult_Headquarters/comments/iwuz9d/q_former_has_discovered_a_real_prophet/,32634,,,t2_6p2xlr33,False,False,0,3,,
iwny01,Major companies like Walmart and Amazon among donors to a QAnon-promoting lawmaker,,Qult_Headquarters,https://www.latimes.com/world-nation/story/2020-09-19/walmart-amazon-among-donors-to-qanon-promoting-lawmaker,0.97,False,,,,/r/Qult_Headquarters/comments/iwny01/major_companies_like_walmart_and_amazon_among/,32634,,,t2_97a3,False,False,0,34,,
iwnh2u,QAnon conspiracists believe in a vast pedophile ring. The truth is sadder,[https://www.theguardian.com/commentisfree/2020/sep/20/qanon-conspiracy-child-abuse-truth-trump](https://www.theguardian.com/commentisfree/2020/sep/20/qanon-conspiracy-child-abuse-truth-trump),Qult_Headquarters,https://www.reddit.com/r/Qult_Headquarters/comments/iwnh2u/qanon_conspiracists_believe_in_a_vast_pedophile/,1.0,False,,,,/r/Qult_Headquarters/comments/iwnh2u/qanon_conspiracists_believe_in_a_vast_pedophile/,32634,,,t2_83vicfts,False,False,0,45,,
iwaw4m,"Q Is Gone, Or Taking A New Approach?",,Qult_Headquarters,https://www.reddit.com/r/QAnonCasualties/comments/iw6j40/this_chump_has_finally_washed_his_hands/,1.0,False,,,,/r/Qult_Headquarters/comments/iwaw4m/q_is_gone_or_taking_a_new_approach/,32634,,,t2_4rry8w6c,False,False,0,11,,
ivwr0q,A German article (translation in comments),,Qult_Headquarters,https://www.spiegel.de/politik/ausland/qanon-warum-ist-die-gefaehrliche-ideologie-so-erfolgreich-podcast-acht-milliarden-a-bc008357-dafa-47ce-9fd8-d43648eaae71,1.0,False,,,,/r/Qult_Headquarters/comments/ivwr0q/a_german_article_translation_in_comments/,32634,,,t2_zj6fr,False,False,0,9,,"de,"
ivos84,RBG dead - and v/qrv links it to a strike on the deep state.,,Qult_Headquarters,https://i.redd.it/liesxwuhf2o51.png,0.96,False,,,,/r/Qult_Headquarters/comments/ivos84/rbg_dead_and_vqrv_links_it_to_a_strike_on_the/,32634,,,t2_5w29lh65,False,False,0,19,,
ivk51x,Qultists are calling Ruth Bader Ginsburg a pedophile and celebrating her death,"I just got a text from my Qultist soon to be brother-in-law saying that he's glad that Ruth Bader Ginsburg is dead, because she was a pedophile. I just checked Twitter, and these loons are spreading their shit all over the place. I'm not usually one to let internet comments bother me, but I'm honestly disgusted right now.",Qult_Headquarters,https://www.reddit.com/r/Qult_Headquarters/comments/ivk51x/qultists_are_calling_ruth_bader_ginsburg_a/,1.0,False,,,,/r/Qult_Headquarters/comments/ivk51x/qultists_are_calling_ruth_bader_ginsburg_a/,32634,,,t2_63rdsejy,False,False,0,120,,
ivfwal,"Friends And Family Members Of QAnon Believers Are Going Through A ""Surreal Goddamn Nightmare""",,Qult_Headquarters,https://www.buzzfeednews.com/amphtml/janelytvynenko/qanon-families-friends?bftwnews=&amp;utm_term=4ldqpgc&amp;__twitter_impression=true,0.97,False,,,,/r/Qult_Headquarters/comments/ivfwal/friends_and_family_members_of_qanon_believers_are/,32634,,,t2_71nbf,False,False,0,74,,
ivewi5,Help! My Boss Is a Conspiracy Theorist,,Qult_Headquarters,https://www.nytimes.com/2020/09/18/business/qanon-boss-conspiracy-theories.html,0.87,False,,,,/r/Qult_Headquarters/comments/ivewi5/help_my_boss_is_a_conspiracy_theorist/,32634,,,t2_12041z,False,False,0,11,,
iv73z6,#ExQAnon - this guy had a good idea and a sense of humor,,Qult_Headquarters,https://i.imgur.com/cMvgIl2.jpg,0.91,False,,,,/r/Qult_Headquarters/comments/iv73z6/exqanon_this_guy_had_a_good_idea_and_a_sense_of/,32634,,,t2_c5ns0,False,False,0,29,,
