ID,Title,Text,Subreddit,URL,Upvote Ratio,Media Only,Media Type,Media URL,Media Title,Permalink,Subreddit Subscribers,Report ReasonsRemoval Reasons,Author,Is Original Content,Is Crosspostable,Num Crossposts,Ups,View Count,Crosspost Parent List - Subdreddit(s)
jd4hjn,Is there some *true* stuff in the whole QAnon extravaganza?,"Now any non-member of the ""cult"" will see it for the extravagant delusion that it is - particularly if you're not American, like me - and can easily list the endless number of outrageous claims or even self-contradicting statements.  But, more interestingly: is there actually some true stuff, here and there, in the whole QA drivel?  (I wouldn't know, since I've only scratched the surface and quickly lost interest after the whole satanic blood drinking child abusers main attraction)",Qult_Headquarters,https://www.reddit.com/r/Qult_Headquarters/comments/jd4hjn/is_there_some_true_stuff_in_the_whole_qanon/,0.71,False,,,,/r/Qult_Headquarters/comments/jd4hjn/is_there_some_true_stuff_in_the_whole_qanon/,32652,,,t2_8itkiw5j,False,False,0,3,,
jd41v7,For some reason this comment section on a video about lost media is infested with Qultists. Anyone know why?,,Qult_Headquarters,https://i.redd.it/oestgakt8qt51.png,0.9,False,,,,/r/Qult_Headquarters/comments/jd41v7/for_some_reason_this_comment_section_on_a_video/,32652,,,t2_8bnvq20n,False,False,0,7,,
jd37iy,The way they pivot is amazing to me. I also can’t believe this is real.,,Qult_Headquarters,https://www.reddit.com/gallery/jd37iy,0.97,False,,,,/r/Qult_Headquarters/comments/jd37iy/the_way_they_pivot_is_amazing_to_me_i_also_cant/,32652,,,t2_7whht261,False,False,0,62,,
jd203w,"Since today is the day JFK Jr. was supposed to return, Q had to post... or repost, that he’s not alive.",,Qult_Headquarters,https://i.redd.it/acrj1oumnpt51.jpg,0.98,False,,,,/r/Qult_Headquarters/comments/jd203w/since_today_is_the_day_jfk_jr_was_supposed_to/,32652,,,t2_12gpcp,False,False,0,77,,
jd00sx,The latest Q Drop is another attempt to shroud the movement from the mainstream,"It begins:   &gt;There is 'Q'. 1  &gt;There are 'Anons'. 2  &gt;There is no 'Qanon'. 3   Basically, even though they've all been absolutely fine with being called ""Qanon"" for years now, tons of their merch says ""Qanon"", all of the sudden they're trying to say that there's no such thing as ""Qanon"".  I'm trying to decide if it's because they need a unified way for their dipshit followers and grifters to avoid further mass bans on social media, or if whoever is posting as Q knows that more attention means a swifter end to their LARP, possibly an irrefutable unmasking like the qmap.pub guy got.",Qult_Headquarters,https://www.reddit.com/r/Qult_Headquarters/comments/jd00sx/the_latest_q_drop_is_another_attempt_to_shroud/,1.0,False,,,,/r/Qult_Headquarters/comments/jd00sx/the_latest_q_drop_is_another_attempt_to_shroud/,32652,,,t2_6qlf4,False,False,0,27,,
jczg5q,"Pastel Qanon, also called Soft Qanon, is the merge between the right-wing Conspiracy Theory that Trump will execute Libs in Guantanamo, and New-Age Hippy-Types who latch onto anyone who says ""Awakening"" or ""Ascending"". This is their anthem.",,Qult_Headquarters,https://www.youtube.com/watch?v=KGAAhzreGWw,1.0,False,youtube.com,,Alex Jones Rants as an Indie Folk Song,/r/Qult_Headquarters/comments/jczg5q/pastel_qanon_also_called_soft_qanon_is_the_merge/,32652,,,t2_51exq,False,False,0,53,,
jcyy3w,CMV: Prove to me QAnon is legit and I'll donate $200 to any accredited charity. Details inside.,"I know a few of you still browse this sub, so I figured I would ask here.  All you need to do is provide me with one piece of falsifiable evidence that Q is actually legitimate intel who has a clue what's going on.  # Take the Q challenge  1. **Provide ANY Q claim** about something. 2. **The claim must be said to take place on or before a specific point in the future**. The sooner the better. 3. **It must be specific enough to be proven true or false with evidence**. For example, you cannot say ""Hillary will be arrested"" and then say ""She's arrested but her clone is out. 4. **It can't be something that's so obvious that MSM has also predicted it**. This is something we would evaluate before the challenge). For example, saying Trump will win a second term is statistically still possible.  Once we settle on that one thing, we wait. We see if it happens. If it happens and you win:  1. **I will donate** **~~$200~~** **$217.17 to the accredited charity of your choice**, to be agreed on before the challenge begins. 2. I will additionally do one of the following:     * leave Reddit     * become an avowed Q supporter     * your choice (within reason).  But if I win after your timeframe elapses, you need to disavow Q instead.  **Do we have a deal?**  Offers extended explicitly to (in \~ order of Reddit prominence)  * [NoraPandora](https://www.reddit.com/user/-NoraPandora-/comments/jdehse/investigation_into_biden_harris_that_the/g98cs0f/?context=3) (ignored) * [GreatAwakening888](https://www.reddit.com/user/GreatAwakening888/comments/j2vgxw/the_spell_is_broken_trump_and_q_confirm_all_five/g94oihj/?utm_source=reddit&amp;utm_medium=web2x&amp;context=3) (TBD) * [Rainmaker\_1776](https://www.reddit.com/user/-NoraPandora-/comments/jdehse/investigation_into_biden_harris_that_the/g997rv3/?context=3) (ignored) * [timtomjimmybigpat](https://www.reddit.com/r/Qult_Headquarters/comments/jcyy3w/cmv_prove_to_me_qanon_is_legit_and_ill_donate_200/g94gs07) (flubbed/refused) * [Vivaldi\_Winter](https://www.reddit.com/user/-NoraPandora-/comments/j973i2/caught_cold_big_changes_are_coming/g8zg8ff/) (refused) * [AbnDDS1](https://www.reddit.com/user/-NoraPandora-/comments/jcyjfj/giant_red_wave_coming/g94a7s5/?context=3) (ignored) * [googoogone](https://www.reddit.com/r/Qult_Headquarters/comments/jdnbig/jfk_jr_truther_currently_having_breakdown_34/g9al17u) (refused) * [steehfan](https://www.reddit.com/r/u_-NoraPandora-/comments/jdehse/investigation_into_biden_harris_that_the/g9av4mx?context=2) (refused) * [Ultimategifttogod1](https://www.reddit.com/r/u_-NoraPandora-/comments/jdehse/investigation_into_biden_harris_that_the/g9bqsoa?context=3) (refused)  Amendments suggested:  * None",Qult_Headquarters,https://www.reddit.com/r/Qult_Headquarters/comments/jcyy3w/cmv_prove_to_me_qanon_is_legit_and_ill_donate_200/,0.98,False,,,,/r/Qult_Headquarters/comments/jcyy3w/cmv_prove_to_me_qanon_is_legit_and_ill_donate_200/,32652,,,t2_141pqs,False,False,0,71,,
jcxwlr,I have been a conspiracy theorist my whole life...,"im 29 years old. ive been a conspiracy theorist since 9/11... even at that really young age, i remember telling my mom that the president was lying and that no one will ever win a war on terror because war itself is scary. later, in my teens, i started doing actual research into things like building 7, companies like Haliburton, ufos, all sorts of shit.. teachers in my high school would call me an anarchist because my views were so radical. i was never a loner or depressed though. i had a small class size of 80 and was friends with almost everyone. my close friends loved asking me questions about things like 9/11 and ufos. we would smoke pot and talk about all sorts of shit, and then continue on with normal high school shit. man i miss those days lol... anyway, fast forward to the 2016 election. i was actually a bernie supporter. i never liked or trusted the clintons and thought trump was basically propped up for entertainment purposes so hillary would win. but when the DNC email leak happened and it was linked to russia, my conspiracy senses turned on. to this day, i believe that hack was not what we were told. i am a software engineer professionally. there are some excellent meta data analyses of the hack that make very strong arguments against the hack being from russia and the guccifer 2.0 character.   fast forward to after the election. every time i turn on the msm, trump is being made to look like a racist bumbling fool. i literally didnt even like the guy, but since i dont trust the msm, they made me question my own hatred of the guy. then Q came on the scene. i never actually bought into the idea that Q was working with the trump administration. i thought that was stupid. i basically thought it was just a couple larpers getting in over their heads. i liked the community though because they were receptive to conspiracies of all kinds. it did make me look at trump in a different light though. i started giving him more of a chance and trying to listen to him in a different light. today, idk whether trump is good or bad. im still trying to figure out his true intentions.  the entire Q phenomenon is very interesting. there are aspects of it that do have merit with me. such as the whole russia hack and also the pedophile rings. no, i do not belive there is a massive satanic pedophile ring being run by the heads of the DNC. but i do believe there are massive human trafficking markets that exist wayyy beyond partisan political lines. throughout my conspiracy research, i have read countless accounts and first hand testimonies of people directly involved in such things. so the fact that Q brings this to light is what attracts a lot of people to the whole qanon community. there IS some truth to it. child trafficking goes on all over the world. and many times, the people who are customers would shock u. remember, drugs are cheap. hobos can be drug addicts easily. finding ur way into a child trafficking market is going to require connections and money. but i digress. the point is, Q has elements of truth in it which is what makes it so powerful. but i also understand why its being shit on. these elements of truth have been twisted into a story where trump and the ""white hats"" save the world. i do not subscribe to this. but i also dont throw away the elements of truth that do exist..  idk where someone like me fits in here... idk the whole truth. and i highly doubt u do either... but there are two dangerous things happening here. One, people are blindly trusting trump and the administration to save the world. and two, the opposers are throwing away good information with the garbage..",Qult_Headquarters,https://www.reddit.com/r/Qult_Headquarters/comments/jcxwlr/i_have_been_a_conspiracy_theorist_my_whole_life/,0.33,False,,,,/r/Qult_Headquarters/comments/jcxwlr/i_have_been_a_conspiracy_theorist_my_whole_life/,32652,,,t2_6ohb17az,False,False,0,0,,
jcx21v,Why is Qanon a threat to the united states,"Ive heard this from multiple news sources. And obviously every major social media platform have been taking everything Qanon down. I can understand why the part about believing there are satan worshipping democrat elites is unhealthy to believe in lol.  But obviously the part about stopping pedos is a noble thing to believe in. So when im asked why its a threat to the united states, I’d like to have a good answer.   So far, ive just been saying that it incited violence and spreads misinformation that influences politics and stuff.",Qult_Headquarters,https://www.reddit.com/r/Qult_Headquarters/comments/jcx21v/why_is_qanon_a_threat_to_the_united_states/,0.64,False,,,,/r/Qult_Headquarters/comments/jcx21v/why_is_qanon_a_threat_to_the_united_states/,32652,,,t2_p6gg6,False,False,0,3,,
jcw0n9,Donald Trump is the QAnon president. And he's proud of it | Donald Trump,,Qult_Headquarters,https://www.theguardian.com/commentisfree/2020/oct/17/donald-trump-is-the-qanon-president-and-hes-proud-of-it,0.96,False,,,,/r/Qult_Headquarters/comments/jcw0n9/donald_trump_is_the_qanon_president_and_hes_proud/,32652,,,t2_1203qd,False,False,0,17,,
jcvo6o,Great Job r/Qult crew,Just saw the CNN piece on Q and that led me here. I have used reddit for awhile and have had great success with getting ideas for things in my life.  Qult\_Headquarters was instrumental in saving that guys life. Kudo's to you.  &amp;#x200B;  I have been battling the qooqs on Twitter and the amount of misinfo on there is mind boggling.  &amp;#x200B;  Keep up the good fight. I am onboard.,Qult_Headquarters,https://www.reddit.com/r/Qult_Headquarters/comments/jcvo6o/great_job_rqult_crew/,0.99,False,,,,/r/Qult_Headquarters/comments/jcvo6o/great_job_rqult_crew/,32652,,,t2_q48st,False,False,0,131,,
jcpuw3,Is QAnon game gone wrong? | FT Film [15:50] have they been duped into LARPing?,,Qult_Headquarters,https://youtu.be/-4vb6UWhf3o,0.82,False,youtube.com,,Is QAnon game gone wrong? | FT Film,/r/Qult_Headquarters/comments/jcpuw3/is_qanon_game_gone_wrong_ft_film_1550_have_they/,32652,,,t2_23o6chvo,False,False,0,7,,
jcpnui,"Qultist Reverse False flags, actions taken by Qcumbers that want to pre-emptively distance themselves from Qanon... will have a breadcrumb trail that leads observers to back to Q","Qcumbers talk alot about false flags, but since they're dedicated followers of an Anonymous LARPer it's not up to them who is or ir not part of the Qunatic Cinematic Universe.   But this narrative holds them together, anything that a Qultist does that is contrary to keeping the peaceful facade of Qanon despite the escalating violence behind it.   So I think there will be false flags, of a sense, where Qanon belivers ""Run Cover"" for each other. They ""fake false flags"" by staging attacks, with paintballs or worse. We have already seen them flood anti-trafficking orgs with nonsense, so why not regular nine one one? It seems natural to the cult that's dedicated to one-upping one another with new ways to OWN THE LIBS.  Qanon said to distance themselves from him, but there's a breadcrumb trail that leads Qultists to Qcumbers, because they need a real way to follow their priests, the decoders who tell them what Q and more importantly Trump really mean when they spew shit.   Qcumbers aren't smart enough to camouflage themselves, if you remember `fren world` with baby talking frogs and HVAC l337speak racism.",Qult_Headquarters,https://www.reddit.com/r/Qult_Headquarters/comments/jcpnui/qultist_reverse_false_flags_actions_taken_by/,1.0,False,,,,/r/Qult_Headquarters/comments/jcpnui/qultist_reverse_false_flags_actions_taken_by/,32652,,,t2_51exq,False,False,0,7,,
jcp74e,Thank You.,"I found your page after reading about a man who came out of QAnon after two years of falling down the rabbit hole.  I never bought into anything QAnon said, or continues to say, but it is so easy to get sucked into it without understanding what you're getting into!  Since I was a teen I've looked into conspiracies of all kinds. Sometimes to have laugh, other time because I genuinely wanted to understand why someone believed a certain way, all taken with a grain of salt. But this stuf...its not funny, and it's certainly not worth knowing. It makes you sick, disgusted, confused. I can't understand why anyone would want to start something like this. I have acquaintances who post about QAnon topics and it is so unsettling. But anyways, thank you for creating this page to shed some light into that horrible dark tunnel.",Qult_Headquarters,https://www.reddit.com/r/Qult_Headquarters/comments/jcp74e/thank_you/,1.0,False,,,,/r/Qult_Headquarters/comments/jcp74e/thank_you/,32652,,,t2_896ks3nu,False,False,0,39,,
jcok9u,"To anyone wondering what adrenochrome actually is/does, i've linked a few testimonies of people who've taken it",[https://erowid.org/experiences/exp.php?ID=51847](https://erowid.org/experiences/exp.php?ID=51847)     [https://erowid.org/experiences/exp.php?ID=65371](https://erowid.org/experiences/exp.php?ID=65371)     [https://erowid.org/chemicals/adrenochrome/adrenochrome\_info1.shtml](https://erowid.org/chemicals/adrenochrome/adrenochrome_info1.shtml)     feel free to send these links to anyone who's claiming it's some magic drug that extends your life or gives you an unimaginable high :),Qult_Headquarters,https://www.reddit.com/r/Qult_Headquarters/comments/jcok9u/to_anyone_wondering_what_adrenochrome_actually/,1.0,False,,,,/r/Qult_Headquarters/comments/jcok9u/to_anyone_wondering_what_adrenochrome_actually/,32652,,,t2_1uir7zn3,False,False,0,18,,
jcmr4y,Cobrainfo1’s last tweet,"I don’t know if anyone is familiar with that account but he’s pretty popular among anons, I went on his acc expecting some craziness and instead I found this: [foot fetish ](https://twitter.com/cobrainfo1/status/1317273703865065473?s=21)",Qult_Headquarters,https://www.reddit.com/r/Qult_Headquarters/comments/jcmr4y/cobrainfo1s_last_tweet/,1.0,False,,,,/r/Qult_Headquarters/comments/jcmr4y/cobrainfo1s_last_tweet/,32652,,,t2_53o31jmh,False,False,0,8,,
jcmork,Confused,"So why is Qanon in other countries? Like this is just weird to me because I thought it was just Americans  brainwashed by Trump. So if you guys know any European people in the Qult, what do they gain from it? MAGA Americans get to vilify dems and fall Trump a savior.  Sincerely, a confused American that eats babies in satanic rituals",Qult_Headquarters,https://www.reddit.com/r/Qult_Headquarters/comments/jcmork/confused/,0.77,False,,,,/r/Qult_Headquarters/comments/jcmork/confused/,32652,,,t2_867v8o7c,False,False,0,7,,
jcla4a,Adrenodumb,"I'm sure this has been covered ad nauseam but it just seems to me that solid consistent debunking of the adenochrome thing might bring a lot of people to their senses?  I mean, it cannot be ingested.  Well it can be but your digestive system destroys it completely.  If you inject it, all it does is clot your blood. It has been tested on rats extensively and all it ever did for them is give them heart failure, not long life or euphoric behavior.  It's can't be extracted from blood.  The synthetic form is neither atrociously expensive nor a rare and exotic drug by any means.  You'd have more luck getting high off an epi-pen.  As far as that goes, farm animals facing the terror of the slaughterhouse would be a better and more consistent source IF it could be 'beneficial' as a blood product.  I never see anyone talking about this stuff.  Would it help?",Qult_Headquarters,https://www.reddit.com/r/Qult_Headquarters/comments/jcla4a/adrenodumb/,1.0,False,,,,/r/Qult_Headquarters/comments/jcla4a/adrenodumb/,32652,,,t2_143dph,False,False,0,10,,
jcl427,I can’t help feel sympathy,"So I’ve several Qultists on my feed. It’s a morbid curiosity. Typically they’re posting 10-15 times a day. Often long rambling posts about how no one can stop what’s happening and how they’re digital warriors on a battlefield they didn’t chose, etc etc   What I’ve started to realise recently is each post they make gets about 10 likes max, sometimes none. So I think, who are these 10 people liking this? And it’s 10 random qultists from different countries who as it turns out post the same kinda crap. So clearly it’s never friends or family doling out the likes.  So that’s it. This digital war is their sole purpose.  Friends and family are either ignoring or blocking them. Spend their days researching for the cause. All that sacrifice, for the same 10 people you don’t even know liking your stuff, and only because you’re liking their stuff. It’s sad",Qult_Headquarters,https://www.reddit.com/r/Qult_Headquarters/comments/jcl427/i_cant_help_feel_sympathy/,0.8,False,,,,/r/Qult_Headquarters/comments/jcl427/i_cant_help_feel_sympathy/,32652,,,t2_kmrhq,False,False,0,19,,
jcl2uq,Shocker of the century: JFK Jr. will not reveal himself tomorrow,"According to my dad, it’s too dangerous for him to reveal himself because there was an assasination attempt on Trump and Melania the other day. Apparently they had to leave the stage at one of his rallies and come back because of an assasin nearby, but I never personally saw this.   JFK Jr. is officially the hide-and-seek champion.",Qult_Headquarters,https://www.reddit.com/r/Qult_Headquarters/comments/jcl2uq/shocker_of_the_century_jfk_jr_will_not_reveal/,0.99,False,,,,/r/Qult_Headquarters/comments/jcl2uq/shocker_of_the_century_jfk_jr_will_not_reveal/,32652,,,t2_7qujgkou,False,False,0,130,,
jckl9x,"Q Drop 4873: Q, the belief system you created is beyond description. That's why the social media mods are taking action.",https://preview.redd.it/ancgk6d7jjt51.png?width=493&amp;format=png&amp;auto=webp&amp;s=f15cb37332b8f62d3360445861501b6339700d03,Qult_Headquarters,https://www.reddit.com/r/Qult_Headquarters/comments/jckl9x/q_drop_4873_q_the_belief_system_you_created_is/,1.0,False,,,,/r/Qult_Headquarters/comments/jckl9x/q_drop_4873_q_the_belief_system_you_created_is/,32652,,,t2_6cjvnvjv,False,False,0,6,,
jckk20,Read this incredible Article,"A reminder: Read the article in The Daily Beast from September about former CIA agent Michael Scheuer who joined Qanon.  'Michael Scheuer used to Hunt bin Laden for the CIA: but now he wants Americans Dead.' If you voted against Trump you are the enemy - America's biggest existential threat and the time for talk is over - they want to kill us - especially if Trump loses. He says Q is right ""60% of the time"" which he claims is remarkable. For example, underneath the cute Q conspiracies are contingents of people that view the shooter Rittenhouse as a hero. Qanon is being taken down on Twitter and FB for very real reasons. Not because of mole children or crazy conspiracies (though he believes JFK jr is still alive) - no, they see Qanon as a meeting room online where they will become more focused on fighting ""Marxists"" at home. These people want to harm Americans. My interest in Qanon lies in that militant faction rather than the silly stuff that creates a good cover for them. They are using Trump but are obviously very loyal to him. Long after Trump is gone Qanon will be moving forward and it might get absolutely out of hand - civil war. Scheuer says it's reasonable to expect violence. I don't know who they expect to actually fight but assassinations are a good start according to Scheuer. They're a cult. Like zombies that we can't reason with - capable of being volatile and violent. When you read an article like this one -which is still relatively new -you realize that this is no joke. Taking away their platforms is a good idea - but they will pool their money and create online forums that are much better than the ones they are trying to get off the ground right now. This is just the beginning of a worldwide problem and the new ""enemy"" is Americans who are not supporting Q religious and political extremism. Qanon will play a central role in all of this. Perfect storm.",Qult_Headquarters,https://www.reddit.com/r/Qult_Headquarters/comments/jckk20/read_this_incredible_article/,1.0,False,,,,/r/Qult_Headquarters/comments/jckk20/read_this_incredible_article/,32652,,,t2_8h0r30d3,False,False,0,1,,
jckil6,"Q Drop 4871: Nothing is going to habben, Q.",https://preview.redd.it/0t8mr0stijt51.png?width=496&amp;format=png&amp;auto=webp&amp;s=5a601bf84db1905dd4340906da5588d8d2fd7b91,Qult_Headquarters,https://www.reddit.com/r/Qult_Headquarters/comments/jckil6/q_drop_4871_nothing_is_going_to_habben_q/,0.6,False,,,,/r/Qult_Headquarters/comments/jckil6/q_drop_4871_nothing_is_going_to_habben_q/,32652,,,t2_6cjvnvjv,False,False,0,1,,
jck1xp,Q Drop 4866: Q attempts to show this Hunter Biden stuff is proof things are about to habben for really (...) really real now!,[Keep in mind this post was made two days ago from the time of this writing.](https://preview.redd.it/4a1de4yjdjt51.png?width=494&amp;format=png&amp;auto=webp&amp;s=ad8c76d10c915daa477ec4b44ed32cba5a25815f),Qult_Headquarters,https://www.reddit.com/r/Qult_Headquarters/comments/jck1xp/q_drop_4866_q_attempts_to_show_this_hunter_biden/,0.67,False,,,,/r/Qult_Headquarters/comments/jck1xp/q_drop_4866_q_attempts_to_show_this_hunter_biden/,32652,,,t2_6cjvnvjv,False,False,0,1,,
jcjzpy,"Qult Adjacent: Some Shit Is Going Down In Alaska, Man",,Qult_Headquarters,https://defector.com/some-shit-is-going-down-in-alaska-man/,0.92,False,,,,/r/Qult_Headquarters/comments/jcjzpy/qult_adjacent_some_shit_is_going_down_in_alaska/,32652,,,t2_4u83y,False,False,0,9,,
jcjysm,Q Drop 4863: It is incredible how much QAnon has grown. I guess they've figured out the perfect way to indoctrinate people.,https://preview.redd.it/klnx1lspcjt51.png?width=495&amp;format=png&amp;auto=webp&amp;s=0854002483c5295fdbd981877ece9e7a4b8cc313,Qult_Headquarters,https://www.reddit.com/r/Qult_Headquarters/comments/jcjysm/q_drop_4863_it_is_incredible_how_much_qanon_has/,0.5,False,,,,/r/Qult_Headquarters/comments/jcjysm/q_drop_4863_it_is_incredible_how_much_qanon_has/,32652,,,t2_6cjvnvjv,False,False,0,0,,
jcjxli,"Q Drop 4861: Q has to prop up an Anon who is losing faith. But isn't Bing by ""Deep State"" Microsoft?",https://preview.redd.it/n4k486q5cjt51.png?width=496&amp;format=png&amp;auto=webp&amp;s=e52639c1ce2a5b4165067ed994cc428f239b8809  Note: #4862 is a screenshot of those results.,Qult_Headquarters,https://www.reddit.com/r/Qult_Headquarters/comments/jcjxli/q_drop_4861_q_has_to_prop_up_an_anon_who_is/,0.67,False,,,,/r/Qult_Headquarters/comments/jcjxli/q_drop_4861_q_has_to_prop_up_an_anon_who_is/,32652,,,t2_6cjvnvjv,False,False,0,2,,
jcig8c,Trump or Biden for the 2020 Presidency.,"Out of curiosity, who here is voting for Biden or Trump?  I'm curious as the intent of this sub is to debunk Q, but has that impacted the way you're voting, as Trump claimed on the townhall last night he had no idea about Qanon.  Genuinely curious to see the results.  [View Poll](https://www.reddit.com/poll/jcig8c)",Qult_Headquarters,https://www.reddit.com/r/Qult_Headquarters/comments/jcig8c/trump_or_biden_for_the_2020_presidency/,0.5,False,,,,/r/Qult_Headquarters/comments/jcig8c/trump_or_biden_for_the_2020_presidency/,32652,,,t2_14m9f1gt,False,False,0,0,,
