ID,Title,Text,Subreddit,URL,Upvote Ratio,Media Only,Media Type,Media URL,Media Title,Permalink,Subreddit Subscribers,Report ReasonsRemoval Reasons,Author,Is Original Content,Is Crosspostable,Num Crossposts,Ups,View Count,Crosspost Parent List - Subdreddit(s)
je1pju,"According to the Holy Messiah, Biden is now significantly worse than evil demonic Cabal leader Hillary Clinton. What say the Qultists? This is a bit of a curve ball.",,Qult_Headquarters,https://i.redd.it/2xcfi8fo02u51.jpg,0.98,False,,,,/r/Qult_Headquarters/comments/je1pju/according_to_the_holy_messiah_biden_is_now/,32634,,,t2_wtacu,False,False,0,71,,
je0dgj,QAnon has hijacked the name of a real organization trying to save children - CNN Video,,Qult_Headquarters,https://www.cnn.com/videos/tech/2020/10/19/save-the-children-qanon-conspiracy-gr-orig.cnn,0.78,False,,,,/r/Qult_Headquarters/comments/je0dgj/qanon_has_hijacked_the_name_of_a_real/,32634,,,t2_fojuj,False,False,0,5,,"QanonHoax,"
jdwy2c,"Loose, superficial mainstream take on a ""key player"" of Qanon according to Heavy.com...Possible disaffected CIA and NSA involvement? You decide.",,Qult_Headquarters,https://heavy.com/news/thomas-schoenberger-qanon/,0.89,False,,,,/r/Qult_Headquarters/comments/jdwy2c/loose_superficial_mainstream_take_on_a_key_player/,32634,,,t2_10dzl0,False,False,0,14,,
jdw688,Obviously fake quotes from Qanon mascot Mel Gibson. Totally not a part of the “Hollywood elite”.,,Qult_Headquarters,https://www.reddit.com/gallery/jdw688,0.92,False,,,,/r/Qult_Headquarters/comments/jdw688/obviously_fake_quotes_from_qanon_mascot_mel/,32634,,,t2_7qujgkou,False,False,0,31,,
jdv15k,"Uh oh, just a glitch. Interesting who picked up the slack",,Qult_Headquarters,https://krebsonsecurity.com/2020/10/qanon-8chan-sites-briefly-knocked-offline/,1.0,False,,,,/r/Qult_Headquarters/comments/jdv15k/uh_oh_just_a_glitch_interesting_who_picked_up_the/,32634,,,t2_q48st,False,False,0,24,,
jdsmtq,Imagine being this devoted to a prank from 4chan,,Qult_Headquarters,https://v.redd.it/myim465xgut51,0.96,False,,,,/r/Qult_Headquarters/comments/jdsmtq/imagine_being_this_devoted_to_a_prank_from_4chan/,32634,,,t2_2zwlovl3,False,False,0,50,,"InfowarriorRides,"
jdpjjc,A reminder that Project Looking Glass is MAINLINE QAnon stuff,"[https://mobile.twitter.com/dulhunty/status/1317834809335443457](https://mobile.twitter.com/dulhunty/status/1317834809335443457)  Seriously, there are things in the QAnon splinter factions and dismissed by the mainline Qs that are far less crazy!",Qult_Headquarters,https://www.reddit.com/r/Qult_Headquarters/comments/jdpjjc/a_reminder_that_project_looking_glass_is_mainline/,0.94,False,,,,/r/Qult_Headquarters/comments/jdpjjc/a_reminder_that_project_looking_glass_is_mainline/,32634,,,t2_6cjvnvjv,False,False,0,21,,
jdp5xa,Q-uadruple: Drops 4898-4901: Do you see a pattern? Do you see a pattern? Do you see a pattern? Do you see a pattern?,https://preview.redd.it/cznlvm68cxt51.png?width=1005&amp;format=png&amp;auto=webp&amp;s=474c30819f4aaba2fd8267884c77e067d018e22d,Qult_Headquarters,https://www.reddit.com/r/Qult_Headquarters/comments/jdp5xa/quadruple_drops_48984901_do_you_see_a_pattern_do/,0.83,False,,,,/r/Qult_Headquarters/comments/jdp5xa/quadruple_drops_48984901_do_you_see_a_pattern_do/,32634,,,t2_6cjvnvjv,False,False,0,4,,
jdp5fn,Q Drop 4892: Just a Trump tweet,https://preview.redd.it/tr7njuq3bxt51.png?width=495&amp;format=png&amp;auto=webp&amp;s=c331e3cf3da23af30d1feafa68b668fc81c4f953,Qult_Headquarters,https://www.reddit.com/r/Qult_Headquarters/comments/jdp5fn/q_drop_4892_just_a_trump_tweet/,0.69,False,,,,/r/Qult_Headquarters/comments/jdp5fn/q_drop_4892_just_a_trump_tweet/,32634,,,t2_6cjvnvjv,False,False,0,5,,
jdp53y,Q Droop 4889: Just a picture and a link.,[#StopItQ](https://preview.redd.it/l10ygdioaxt51.png?width=491&amp;format=png&amp;auto=webp&amp;s=355623f0889220ca8a82bf6d8aa7bc30facb2c18),Qult_Headquarters,https://www.reddit.com/r/Qult_Headquarters/comments/jdp53y/q_droop_4889_just_a_picture_and_a_link/,0.72,False,,,,/r/Qult_Headquarters/comments/jdp53y/q_droop_4889_just_a_picture_and_a_link/,32634,,,t2_6cjvnvjv,False,False,0,3,,
jdorvl,Welp boys...looks like there is gonna be a glut of Harleys on the market soon,,Qult_Headquarters,https://bringmethenews.com/minnesota-news/wapo-known-covid-cases-from-sturgis-rally-may-be-tip-of-the-iceberg,0.75,False,,,,/r/Qult_Headquarters/comments/jdorvl/welp_boyslooks_like_there_is_gonna_be_a_glut_of/,32634,,,t2_eg1rd,False,False,0,9,,
jdmuy0,Qultists have organized demonstrations outside a grocery store near the Gates Foundation offices in Seattle (not in the same block). I guess that’s close enough?,,Qult_Headquarters,https://www.reddit.com/gallery/jdmuy0,0.82,False,,,,/r/Qult_Headquarters/comments/jdmuy0/qultists_have_organized_demonstrations_outside_a/,32634,,,t2_2zfvw32g,False,False,0,9,,
jdi1xm,Qanon turns into a Religion for Tax Purposes after a Biden win,"Qanon would look pretty debunked after a Biden win, it would look discredited, deceitful dreck, and lots of other bad d-words. It would look Donald-y.   But that [won't stop them](https://i.imgur.com/xNJgFpK.png) because Where we go one we go all. This means all the people who have sunk their time and effort into being `Digital Soldiers` (digital soldiers are the champions!) who are in too deep to quit will look for a life raft of some sort. That's when it's time for the Decoder-class Priests on The Blue Birb Hellsite to put their work into maximum overdrive.   They'll take their network of various peanut-gallery organizations dedicated to saving children, patrolling the border, owning teh libz, denying climate change and heiling the president, and reorganize it into a larger charity work.   There will be some schism, there are always schisms, but they will be patched up if not patched over (and forbidden to talk about). People not ""with it"" as decided by the organic consensus made by the grassroots of Qanon running to one centre of power, will be shunned, [erased out of the Qanon history books](https://i.imgur.com/T1Cahfa.jpg) as influencers or prominent names. They're cancelled.  Donald Trump, now out of power, is watching Qanon with interest, waiting to see what form this new reorganization takes before announcing his support. He knows he can instantly rally most Qanon people to one side or another, but that may not be all it needs. If he jumps onto a side and it turns out to be the wrong side (for whatever reason) then it will not support his weight and he will break it before it solidifies. Metaphorically.   So that starts congealing around a few people, and as Trump sees more of his flunkies in jail and unable to help them, he needs to get on the Ark kinda right quick, but it's still moving too fast. So he encourages their growth with his own money hose, where the money is from is never clear, but the influx of cash gives the Qanon movement (which was struggling on the grassroots donations)  the means to actually hire someone competent to take the big step.  File with the IRS for Tax Exempt purposes. They have their umbrella organization, which for story purposes we will call The Church of the Seventeenth Light, and their smaller orgs that do all the usual Qanon and RW Grifter stuff. They build walls, make memes, retweet Babylon Bee as if it's real, and own teh libz. The IRS doesn't believe them, but they don't want to cause a scene. After all John Oliver made his fake religion, and he's a second rate Comedian from across the pond, probably apostasy for not worshiping the Queen really.   So the IRS gives it to them to make them go away, and NOW it is the time for [Donald Trump to descend his magic gold escalator](https://www.youtube.com/watch?v=wCDIYvFmgW8) and accept his place of prominence among the Cult.  Sorry, as the figurehead spiritual leader of the Church of the Seventeenth Light.   This gives him a few things.  1. Adoration of the masses. You can't store this in a box on your desk so he needs it fresh every morning.   2. A way to launder money, without paying Tax, even if the FBI starts looking closely?   3. Sanctuary. Can't be arrested by the Postal Inspection Service if you're in a church surrounded by your followers. The FBI doesn't want another Waco.   And these events, these acts, give new meaning and new life into the Qanon Movement. When everyone thought they were dead, the one-two punch of establishing a Religion and Donald Trump himself acknowledging them, they're here to stay.   But then he gives them all COVID and dies. lmao",Qult_Headquarters,https://www.reddit.com/r/Qult_Headquarters/comments/jdi1xm/qanon_turns_into_a_religion_for_tax_purposes/,0.86,False,,,,/r/Qult_Headquarters/comments/jdi1xm/qanon_turns_into_a_religion_for_tax_purposes/,32634,,,t2_51exq,False,False,0,15,,
jdgm17,Melissa Rainbows aka the Woman Who Had a 24 Hour Meltdown on Instagram Live (Which Ended with Her Husband Having Her Arrested) is Now Trying to Help Others Detach From the Qult,,Qult_Headquarters,https://www.instagram.com/tv/CGdyNtIjZQv/?igshid=482y60tupemu,0.99,False,,,,/r/Qult_Headquarters/comments/jdgm17/melissa_rainbows_aka_the_woman_who_had_a_24_hour/,32634,,,t2_l1xbe,False,False,0,116,,
jdammm,The Demon-Haunted World: Science as a Candle in the Dark by Carl Sagan,"I wanted to recommend *The Demon-Haunted World: Science as a Candle in the Dark* by Carl Sagan as an excellent vaccine against fantastical and dangerous worldviews. It changed my life by helping me to recognize magical thinking, to navigate the psychology of rabbit hole philosophies, to verify facts and to think for myself. Although written in 1996, QAnon is unquestionably the disaster the book was intended to prevent. (The cover proclaims, ""As Sagan demonstrates with lucid eloquence, the siren song of unreason is not just a cultural wrong turn but a dangerous plunge into darkness that threatens our most basic freedoms."")  Perhaps more importantly, *The Demon-Haunted World* is not simply a manual for defensive or dismissive thinking. Rather than leading us simply to take the safe route by rejecting all new ideas, the author encourages us to keep our minds open through ""equal parts skepticism and wonder"" and makes a powerful case for science and reason as the foundation of hope. Former Q member *Jadeja* who despaired ""I don't know what to believe any more"" would do worse than to start here.",Qult_Headquarters,https://www.reddit.com/r/Qult_Headquarters/comments/jdammm/the_demonhaunted_world_science_as_a_candle_in_the/,1.0,False,,,,/r/Qult_Headquarters/comments/jdammm/the_demonhaunted_world_science_as_a_candle_in_the/,32634,,,t2_2jf6c762,False,False,0,21,,
jdagz2,This is it in a nutshell. It must be so exhausting.,,Qult_Headquarters,https://i.redd.it/0xu9ppl5est51.jpg,0.9,False,,,,/r/Qult_Headquarters/comments/jdagz2/this_is_it_in_a_nutshell_it_must_be_so_exhausting/,32634,,,t2_xb33z,False,False,0,25,,
jda2r2,You know the JFK Jr larper who set the expectation for a big reveal today? He’s now telling Qultists there are three moons.,,Qult_Headquarters,https://twitter.com/hsretoucher/status/1317660422279811072?s=21,0.98,False,twitter.com,https://twitter.com/HSRetoucher/status/1317660422279811072,,/r/Qult_Headquarters/comments/jda2r2/you_know_the_jfk_jr_larper_who_set_the/,32634,,,t2_1kfzy4ad,False,False,1,107,,
jd8ehc,IS JORDAN SATHER HAVING A BAD TIME ???,,Qult_Headquarters,https://i.redd.it/t6tnetkvmrt51.jpg,1.0,False,,,,/r/Qult_Headquarters/comments/jd8ehc/is_jordan_sather_having_a_bad_time/,32634,,,t2_17v7j3r,False,False,0,152,,
jd7wmj,[Humor-ish] I need a break from this madness,"I was driving around the other night and a car pulled out in front of me. On the back of the car was a metal decal that said ""Q 45"".  &amp;#x200B;  Naturally, I was mad. I couldn't believe what I was seeing cause this is the first time I have seen one here. I got so annoyed that I was seeing one of the Qult members right in the flesh ...until I realized that it was in fact the [type of car](https://en.wikipedia.org/wiki/Infiniti_Q45) that the decal was for.  &amp;#x200B;  This shit is getting to me, man.",Qult_Headquarters,https://www.reddit.com/r/Qult_Headquarters/comments/jd7wmj/humorish_i_need_a_break_from_this_madness/,0.92,False,,,,/r/Qult_Headquarters/comments/jd7wmj/humorish_i_need_a_break_from_this_madness/,32634,,,t2_2dbxtld7,False,False,0,10,,
jd53bo,"Matt Lauer harassed a few of his coworkers, therefore everything Q said must be real!",,Qult_Headquarters,https://old.reddit.com/r/conspiracy/comments/jcjv7f/this_woman_worked_with_and_covered_for_sexual/?sort=top,0.94,False,,,,/r/Qult_Headquarters/comments/jd53bo/matt_lauer_harassed_a_few_of_his_coworkers/,32634,,,t2_rb538,False,False,0,22,,
jd41v7,For some reason this comment section on a video about lost media is infested with Qultists. Anyone know why?,,Qult_Headquarters,https://i.redd.it/oestgakt8qt51.png,0.92,False,,,,/r/Qult_Headquarters/comments/jd41v7/for_some_reason_this_comment_section_on_a_video/,32634,,,t2_8bnvq20n,False,False,0,9,,
jd2p93,Biden does photo op in a Dairy Queen. The Qultists are on to his comms. Lol.,,Qult_Headquarters,https://i.redd.it/fc4qfe1rupt51.jpg,0.97,False,,,,/r/Qult_Headquarters/comments/jd2p93/biden_does_photo_op_in_a_dairy_queen_the_qultists/,32634,,,t2_3nmho,False,False,0,25,,
jcymr3,I’ve been ignoring Qs for a while but it feels a lot like 2016.,,Qult_Headquarters,https://i.redd.it/18wn13r4qot51.jpg,0.97,False,,,,/r/Qult_Headquarters/comments/jcymr3/ive_been_ignoring_qs_for_a_while_but_it_feels_a/,32634,,,t2_3he7ogoj,False,False,1,255,,
jcxwlr,I have been a conspiracy theorist my whole life...,"im 29 years old. ive been a conspiracy theorist since 9/11... even at that really young age, i remember telling my mom that the president was lying and that no one will ever win a war on terror because war itself is scary. later, in my teens, i started doing actual research into things like building 7, companies like Haliburton, ufos, all sorts of shit.. teachers in my high school would call me an anarchist because my views were so radical. i was never a loner or depressed though. i had a small class size of 80 and was friends with almost everyone. my close friends loved asking me questions about things like 9/11 and ufos. we would smoke pot and talk about all sorts of shit, and then continue on with normal high school shit. man i miss those days lol... anyway, fast forward to the 2016 election. i was actually a bernie supporter. i never liked or trusted the clintons and thought trump was basically propped up for entertainment purposes so hillary would win. but when the DNC email leak happened and it was linked to russia, my conspiracy senses turned on. to this day, i believe that hack was not what we were told. i am a software engineer professionally. there are some excellent meta data analyses of the hack that make very strong arguments against the hack being from russia and the guccifer 2.0 character.   fast forward to after the election. every time i turn on the msm, trump is being made to look like a racist bumbling fool. i literally didnt even like the guy, but since i dont trust the msm, they made me question my own hatred of the guy. then Q came on the scene. i never actually bought into the idea that Q was working with the trump administration. i thought that was stupid. i basically thought it was just a couple larpers getting in over their heads. i liked the community though because they were receptive to conspiracies of all kinds. it did make me look at trump in a different light though. i started giving him more of a chance and trying to listen to him in a different light. today, idk whether trump is good or bad. im still trying to figure out his true intentions.  the entire Q phenomenon is very interesting. there are aspects of it that do have merit with me. such as the whole russia hack and also the pedophile rings. no, i do not belive there is a massive satanic pedophile ring being run by the heads of the DNC. but i do believe there are massive human trafficking markets that exist wayyy beyond partisan political lines. throughout my conspiracy research, i have read countless accounts and first hand testimonies of people directly involved in such things. so the fact that Q brings this to light is what attracts a lot of people to the whole qanon community. there IS some truth to it. child trafficking goes on all over the world. and many times, the people who are customers would shock u. remember, drugs are cheap. hobos can be drug addicts easily. finding ur way into a child trafficking market is going to require connections and money. but i digress. the point is, Q has elements of truth in it which is what makes it so powerful. but i also understand why its being shit on. these elements of truth have been twisted into a story where trump and the ""white hats"" save the world. i do not subscribe to this. but i also dont throw away the elements of truth that do exist..  idk where someone like me fits in here... idk the whole truth. and i highly doubt u do either... but there are two dangerous things happening here. One, people are blindly trusting trump and the administration to save the world. and two, the opposers are throwing away good information with the garbage..",Qult_Headquarters,https://www.reddit.com/r/Qult_Headquarters/comments/jcxwlr/i_have_been_a_conspiracy_theorist_my_whole_life/,0.38,False,,,,/r/Qult_Headquarters/comments/jcxwlr/i_have_been_a_conspiracy_theorist_my_whole_life/,32634,,,t2_6ohb17az,False,False,0,0,,
jcx21v,Why is Qanon a threat to the united states,"Ive heard this from multiple news sources. And obviously every major social media platform have been taking everything Qanon down. I can understand why the part about believing there are satan worshipping democrat elites is unhealthy to believe in lol.  But obviously the part about stopping pedos is a noble thing to believe in. So when im asked why its a threat to the united states, I’d like to have a good answer.   So far, ive just been saying that it incited violence and spreads misinformation that influences politics and stuff.",Qult_Headquarters,https://www.reddit.com/r/Qult_Headquarters/comments/jcx21v/why_is_qanon_a_threat_to_the_united_states/,0.58,False,,,,/r/Qult_Headquarters/comments/jcx21v/why_is_qanon_a_threat_to_the_united_states/,32634,,,t2_p6gg6,False,False,0,2,,
jcpnui,"Qultist Reverse False flags, actions taken by Qcumbers that want to pre-emptively distance themselves from Qanon... will have a breadcrumb trail that leads observers to back to Q","Qcumbers talk alot about false flags, but since they're dedicated followers of an Anonymous LARPer it's not up to them who is or ir not part of the Qunatic Cinematic Universe.   But this narrative holds them together, anything that a Qultist does that is contrary to keeping the peaceful facade of Qanon despite the escalating violence behind it.   So I think there will be false flags, of a sense, where Qanon belivers ""Run Cover"" for each other. They ""fake false flags"" by staging attacks, with paintballs or worse. We have already seen them flood anti-trafficking orgs with nonsense, so why not regular nine one one? It seems natural to the cult that's dedicated to one-upping one another with new ways to OWN THE LIBS.  Qanon said to distance themselves from him, but there's a breadcrumb trail that leads Qultists to Qcumbers, because they need a real way to follow their priests, the decoders who tell them what Q and more importantly Trump really mean when they spew shit.   Qcumbers aren't smart enough to camouflage themselves, if you remember `fren world` with baby talking frogs and HVAC l337speak racism.",Qult_Headquarters,https://www.reddit.com/r/Qult_Headquarters/comments/jcpnui/qultist_reverse_false_flags_actions_taken_by/,1.0,False,,,,/r/Qult_Headquarters/comments/jcpnui/qultist_reverse_false_flags_actions_taken_by/,32634,,,t2_51exq,False,False,0,7,,
jcok9u,"To anyone wondering what adrenochrome actually is/does, i've linked a few testimonies of people who've taken it",[https://erowid.org/experiences/exp.php?ID=51847](https://erowid.org/experiences/exp.php?ID=51847)     [https://erowid.org/experiences/exp.php?ID=65371](https://erowid.org/experiences/exp.php?ID=65371)     [https://erowid.org/chemicals/adrenochrome/adrenochrome\_info1.shtml](https://erowid.org/chemicals/adrenochrome/adrenochrome_info1.shtml)     feel free to send these links to anyone who's claiming it's some magic drug that extends your life or gives you an unimaginable high :),Qult_Headquarters,https://www.reddit.com/r/Qult_Headquarters/comments/jcok9u/to_anyone_wondering_what_adrenochrome_actually/,0.93,False,,,,/r/Qult_Headquarters/comments/jcok9u/to_anyone_wondering_what_adrenochrome_actually/,32634,,,t2_1uir7zn3,False,False,0,18,,
jcliy2,A anti-fascist movie made by the US Department of War in 1947. Strangely woke yet chilling at the same time.,,Qult_Headquarters,https://youtu.be/vGAqYNFQdZ4,1.0,False,youtube.com,,Don't Be a Sucker,/r/Qult_Headquarters/comments/jcliy2/a_antifascist_movie_made_by_the_us_department_of/,32634,,,t2_ulmhr,False,False,0,94,,
jclgk6,Trump campaign lawyers are aiding a leading proponent of QAnon.,,Qult_Headquarters,https://www.nytimes.com/2020/10/16/us/elections/trump-campaign-lawyers-are-aiding-a-leading-proponent-of-qanon.html,0.84,False,,,,/r/Qult_Headquarters/comments/jclgk6/trump_campaign_lawyers_are_aiding_a_leading/,32634,,,t2_hhq3wyu,False,False,0,8,,
jckvxy,Q Drop 4877: Just a screenshot of a Tucker Carlson tweet.,https://preview.redd.it/qb0xyrmamjt51.png?width=490&amp;format=png&amp;auto=webp&amp;s=555938e7b71de371124a9bcf340777c608268675,Qult_Headquarters,https://www.reddit.com/r/Qult_Headquarters/comments/jckvxy/q_drop_4877_just_a_screenshot_of_a_tucker_carlson/,0.75,False,,,,/r/Qult_Headquarters/comments/jckvxy/q_drop_4877_just_a_screenshot_of_a_tucker_carlson/,32634,,,t2_6cjvnvjv,False,False,0,2,,
jckbni,"Q Drop 4870: The same tactic of claiming a laptop has unspeakable horrors on it, but not actually showing any of them.",https://preview.redd.it/dhjj7cffgjt51.png?width=496&amp;format=png&amp;auto=webp&amp;s=b8faafb56b3ad6052bf33b94460463cddde39101,Qult_Headquarters,https://www.reddit.com/r/Qult_Headquarters/comments/jckbni/q_drop_4870_the_same_tactic_of_claiming_a_laptop/,0.95,False,,,,/r/Qult_Headquarters/comments/jckbni/q_drop_4870_the_same_tactic_of_claiming_a_laptop/,32634,,,t2_6cjvnvjv,False,False,0,38,,
jchw48,"A bit more on the origins of Q as a LARP (Live Action Role Playing), yes, a game","Stumbled across this article from Italy, there's a button to translate on the upper left of the webpage. [https://www.qresearch.it/2020/10/16/the-game-theory-in-the-qanon-conspiracy-theory/](https://www.qresearch.it/2020/10/16/the-game-theory-in-the-qanon-conspiracy-theory/)",Qult_Headquarters,https://www.reddit.com/r/Qult_Headquarters/comments/jchw48/a_bit_more_on_the_origins_of_q_as_a_larp_live/,0.76,False,,,,/r/Qult_Headquarters/comments/jchw48/a_bit_more_on_the_origins_of_q_as_a_larp_live/,32634,,,t2_12gpcp,False,False,0,6,,
jcho5x,"After the recent Facebook purge, I'm noticing a huge upsurge in so-called ""international"" QAnon posts and comments allegedly coming from Europe, South America, and Asia.",,Qult_Headquarters,https://i.redd.it/t3tsvdkjoit51.jpg,1.0,False,,,,/r/Qult_Headquarters/comments/jcho5x/after_the_recent_facebook_purge_im_noticing_a/,32634,,,t2_11img6,False,False,0,29,,
jchnlf,"Qultists have nailed John Sipher as a CIA asset. Much to his amusement, since “CIA Clandestine Service” is literally in his Twitter bio.",,Qult_Headquarters,https://twitter.com/john_sipher/status/1317158615325736967?s=21,0.85,False,twitter.com,https://twitter.com/john_sipher/status/1317158615325736967,,/r/Qult_Headquarters/comments/jchnlf/qultists_have_nailed_john_sipher_as_a_cia_asset/,32634,,,t2_1kfzy4ad,False,False,0,8,,
jcf3p1,Trump Campaign Lawyers Are Aiding a Leading Proponent of QAnon,,Qult_Headquarters,https://www.nytimes.com/2020/10/16/us/politics/qanon-trump-greene-lawyers.html?action=click&amp;module=Top%20Stories&amp;pgtype=Homepage,0.93,False,,,,/r/Qult_Headquarters/comments/jcf3p1/trump_campaign_lawyers_are_aiding_a_leading/,32634,,,t2_4w8ovur8,False,False,0,22,,
jcebq9,Is it cheating to post voat? Just some totally normal threats to hijack a plane into nuclear plant,&amp;#x200B;  https://preview.redd.it/7a1l4t88tht51.png?width=1125&amp;format=png&amp;auto=webp&amp;s=39ba97c5572cf5adf63d4e1a75d87aa019c2f4b0,Qult_Headquarters,https://www.reddit.com/r/Qult_Headquarters/comments/jcebq9/is_it_cheating_to_post_voat_just_some_totally/,0.94,False,,,,/r/Qult_Headquarters/comments/jcebq9/is_it_cheating_to_post_voat_just_some_totally/,32634,,,t2_3soiqgt8,False,False,0,12,,
jcdjdo,Funny how Q never finds any child traffickers in Russia huh. What a coincidence.,,Qult_Headquarters,https://i.redd.it/vioou35vlht51.jpg,0.93,False,,,,/r/Qult_Headquarters/comments/jcdjdo/funny_how_q_never_finds_any_child_traffickers_in/,32634,,,t2_5rd2naa0,False,False,0,124,,
